2024-07-17 12:44:08
######## 7/17/2024, 12:44:21 PM
tid=d55c22b17a56c4f801b4c8d2ffcc25af

 【请求的 ip 】：13.91.69.162
 【 用  户 】 加了  617         个单词上限2024-07-17 12:45:58
######## 7/17/2024, 12:46:12 PM
tid=d55c22b17a56c4f801b4c8d2ffcc25af

 【请求的 ip 】：52.238.24.178
 【 用  户 】 加了  617         个单词上限2024-07-17 14:42:39
######## 7/17/2024, 2:42:53 PM
tid=d55c22b17a56c4f801b4c8d2ffcc25af

 【请求的 ip 】：20.97.191.96
 【 用  户 】 加了  617         个单词上限2024-07-17 15:39:51
######## 7/17/2024, 3:40:04 PM
tid=d55c22b17a56c4f801b4c8d2ffcc25af

 【请求的 ip 】：20.172.5.221
 【 用  户 】 加了  617         个单词上限2024-07-17 17:40:12
######## 7/17/2024, 5:40:26 PM
tid=d55c22b17a56c4f801b4c8d2ffcc25af

 【请求的 ip 】：172.183.74.6
 【 用  户 】 加了  617         个单词上限2024-07-17 18:40:44
######## 7/17/2024, 6:40:58 PM
tid=d55c22b17a56c4f801b4c8d2ffcc25af

 【请求的 ip 】：20.161.78.13
 【 用  户 】 加了  617         个单词上限2024-07-18 12:41:43
######## 7/18/2024, 12:41:57 PM
tid=d55c22b17a56c4f801b4c8d2ffcc25af

 【请求的 ip 】：20.55.46.196
 【 用  户 】 加了  617         个单词上限2024-07-18 14:42:45
######## 7/18/2024, 2:42:59 PM
tid=d55c22b17a56c4f801b4c8d2ffcc25af

 【请求的 ip 】：52.234.36.37
 【 用  户 】 加了  620         个单词上限2024-07-18 15:39:36
######## 7/18/2024, 3:39:50 PM
tid=d55c22b17a56c4f801b4c8d2ffcc25af

 【请求的 ip 】：172.183.107.128
 【 用  户 】 加了  620         个单词上限2024-07-18 17:39:34
######## 7/18/2024, 5:39:48 PM
tid=d55c22b17a56c4f801b4c8d2ffcc25af

 【请求的 ip 】：52.234.33.242
 【 用  户 】 加了  620         个单词上限2024-07-18 18:40:41
######## 7/18/2024, 6:40:55 PM
tid=d55c22b17a56c4f801b4c8d2ffcc25af

 【请求的 ip 】：172.200.207.226
 【 用  户 】 加了  620         个单词上限2024-07-19 12:41:37
######## 7/19/2024, 12:41:52 PM
tid=d55c22b17a56c4f801b4c8d2ffcc25af

 【请求的 ip 】：20.81.159.194
 【 用  户 】 加了  623         个单词上限2024-07-19 14:42:27
######## 7/19/2024, 2:42:40 PM
tid=be9ac66de488a37972f939c4666d7125

 【请求的 ip 】：13.83.1.192
 【 用  户 】 加了  623         个单词上限2024-07-19 15:39:16
######## 7/19/2024, 3:39:29 PM
tid=be9ac66de488a37972f939c4666d7125

 【请求的 ip 】：52.234.38.142
 【 用  户 】 加了  623         个单词上限2024-07-19 17:41:01
######## 7/19/2024, 5:41:16 PM
tid=be9ac66de488a37972f939c4666d7125

 【请求的 ip 】：20.55.14.228
 【 用  户 】 加了  623         个单词上限2024-07-19 18:39:51
######## 7/19/2024, 6:40:05 PM
tid=be9ac66de488a37972f939c4666d7125

 【请求的 ip 】：20.55.15.36
 【 用  户 】 加了  623         个单词上限2024-07-20 12:41:35
######## 7/20/2024, 12:41:49 PM
tid=be9ac66de488a37972f939c4666d7125

 【请求的 ip 】：172.183.91.8
 【 用  户 】 加了  626         个单词上限2024-07-20 14:41:41
######## 7/20/2024, 2:41:55 PM
tid=be9ac66de488a37972f939c4666d7125

 【请求的 ip 】：172.183.79.2
 【 用  户 】 加了  626         个单词上限2024-07-20 15:39:38
######## 7/20/2024, 3:39:53 PM
tid=be9ac66de488a37972f939c4666d7125

 【请求的 ip 】：20.109.39.177
 【 用  户 】 加了  626         个单词上限2024-07-20 17:40:29
######## 7/20/2024, 5:40:43 PM
tid=be9ac66de488a37972f939c4666d7125

 【请求的 ip 】：4.227.115.112
 【 用  户 】 加了  626         个单词上限2024-07-20 18:41:29
######## 7/20/2024, 6:41:42 PM
tid=be9ac66de488a37972f939c4666d7125

 【请求的 ip 】：13.83.1.208
 【 用  户 】 加了  626         个单词上限2024-07-21 12:39:55
######## 7/21/2024, 12:40:09 PM
tid=be9ac66de488a37972f939c4666d7125

 【请求的 ip 】：172.183.91.2
 【 用  户 】 加了  629         个单词上限2024-07-21 14:42:17
######## 7/21/2024, 2:42:32 PM
tid=be9ac66de488a37972f939c4666d7125

 【请求的 ip 】：20.161.76.227
 【 用  户 】 加了  629         个单词上限2024-07-21 15:39:41
######## 7/21/2024, 3:39:54 PM
tid=be9ac66de488a37972f939c4666d7125

 【请求的 ip 】：172.183.131.79
 【 用  户 】 加了  629         个单词上限2024-07-21 17:39:32
######## 7/21/2024, 5:39:46 PM
tid=97e82118e4c1dacc0f923bc17d8a96e6

 【请求的 ip 】：20.172.6.169
 【 用  户 】 加了  629         个单词上限2024-07-21 18:39:19
######## 7/21/2024, 6:39:33 PM
tid=97e82118e4c1dacc0f923bc17d8a96e6

 【请求的 ip 】：172.183.53.32
 【 用  户 】 加了  629         个单词上限2024-07-22 12:41:16
######## 7/22/2024, 12:41:31 PM
tid=97e82118e4c1dacc0f923bc17d8a96e6

 【请求的 ip 】：20.109.38.149
 【 用  户 】 加了  631         个单词上限2024-07-22 14:43:07
######## 7/22/2024, 2:43:21 PM
tid=97e82118e4c1dacc0f923bc17d8a96e6

 【请求的 ip 】：52.190.141.146
 【 用  户 】 加了  631         个单词上限2024-07-22 15:40:23
######## 7/22/2024, 3:40:37 PM
tid=97e82118e4c1dacc0f923bc17d8a96e6

 【请求的 ip 】：172.183.98.96
 【 用  户 】 加了  631         个单词上限2024-07-22 17:40:25
######## 7/22/2024, 5:40:39 PM
tid=97e82118e4c1dacc0f923bc17d8a96e6

 【请求的 ip 】：172.190.111.148
 【 用  户 】 加了  631         个单词上限2024-07-22 18:40:04
######## 7/22/2024, 6:40:19 PM
tid=97e82118e4c1dacc0f923bc17d8a96e6

 【请求的 ip 】：20.102.46.179
 【 用  户 】 加了  631         个单词上限2024-07-23 12:40:18
######## 7/23/2024, 12:40:35 PM
tid=97e82118e4c1dacc0f923bc17d8a96e6

 【请求的 ip 】：13.83.123.178
 【 用  户 】 加了  631         个单词上限2024-07-23 14:42:36
######## 7/23/2024, 2:42:49 PM
tid=97e82118e4c1dacc0f923bc17d8a96e6

 【请求的 ip 】：40.76.117.200
 【 用  户 】 加了  631         个单词上限2024-07-23 15:39:17
######## 7/23/2024, 3:39:31 PM
tid=97e82118e4c1dacc0f923bc17d8a96e6

 【请求的 ip 】：20.55.213.87
 【 用  户 】 加了  634         个单词上限2024-07-23 17:39:16
######## 7/23/2024, 5:39:31 PM
tid=97e82118e4c1dacc0f923bc17d8a96e6

 【请求的 ip 】：20.172.0.37
 【 用  户 】 加了  634         个单词上限2024-07-23 18:40:06
######## 7/23/2024, 6:40:21 PM
tid=97e82118e4c1dacc0f923bc17d8a96e6

 【请求的 ip 】：20.55.47.50
 【 用  户 】 加了  634         个单词上限2024-07-24 12:40:07
######## 7/24/2024, 12:40:21 PM
tid=a03a309fb3f510fbbc55f31d1206f887

 【请求的 ip 】：52.157.14.88
 【 用  户 】 加了  634         个单词上限2024-07-24 14:42:57
######## 7/24/2024, 2:43:11 PM
tid=a03a309fb3f510fbbc55f31d1206f887

 【请求的 ip 】：20.81.46.155
 【 用  户 】 加了  634         个单词上限2024-07-24 15:39:24
######## 7/24/2024, 3:39:38 PM
tid=a03a309fb3f510fbbc55f31d1206f887

 【请求的 ip 】：20.55.222.97
 【 用  户 】 加了  634         个单词上限2024-07-24 17:39:48
######## 7/24/2024, 5:40:02 PM
tid=a03a309fb3f510fbbc55f31d1206f887

 【请求的 ip 】：20.172.17.131
 【 用  户 】 加了  634         个单词上限2024-07-24 18:40:37
######## 7/24/2024, 6:40:52 PM
tid=a03a309fb3f510fbbc55f31d1206f887

 【请求的 ip 】：74.249.14.213
 【 用  户 】 加了  634         个单词上限2024-07-25 12:42:18
######## 7/25/2024, 12:42:32 PM
tid=a03a309fb3f510fbbc55f31d1206f887

 【请求的 ip 】：20.55.14.229
 【 用  户 】 加了  634         个单词上限2024-07-25 14:42:55
######## 7/25/2024, 2:43:09 PM
tid=a03a309fb3f510fbbc55f31d1206f887

 【请求的 ip 】：172.183.138.55
 【 用  户 】 加了  634         个单词上限2024-07-25 15:39:24
######## 7/25/2024, 3:39:39 PM
tid=a03a309fb3f510fbbc55f31d1206f887

 【请求的 ip 】：20.172.29.182
 【 用  户 】 加了  634         个单词上限2024-07-25 17:39:22
######## 7/25/2024, 5:39:37 PM
tid=a03a309fb3f510fbbc55f31d1206f887

 【请求的 ip 】：52.234.38.241
 【 用  户 】 加了  637         个单词上限2024-07-25 18:40:32
######## 7/25/2024, 6:40:47 PM
tid=a03a309fb3f510fbbc55f31d1206f887

 【请求的 ip 】：172.200.199.173
 【 用  户 】 加了  637         个单词上限2024-07-26 12:42:31
######## 7/26/2024, 12:42:45 PM
tid=a03a309fb3f510fbbc55f31d1206f887

 【请求的 ip 】：20.161.77.207
 【 用  户 】 加了  637         个单词上限2024-07-26 14:43:09
######## 7/26/2024, 2:43:23 PM
tid=d80060adaed8bdfe337fd739313b1a84

 【请求的 ip 】：172.183.108.37
 【 用  户 】 加了  639         个单词上限2024-07-26 15:39:28
######## 7/26/2024, 3:39:41 PM
tid=d80060adaed8bdfe337fd739313b1a84

 【请求的 ip 】：52.225.76.22
 【 用  户 】 加了  639         个单词上限2024-07-26 17:39:28
######## 7/26/2024, 5:39:42 PM
tid=d80060adaed8bdfe337fd739313b1a84

 【请求的 ip 】：52.179.163.79
 【 用  户 】 加了  639         个单词上限2024-07-26 18:40:30
######## 7/26/2024, 6:40:44 PM
tid=d80060adaed8bdfe337fd739313b1a84

 【请求的 ip 】：172.200.199.255
 【 用  户 】 加了  639         个单词上限2024-07-27 12:40:30
######## 7/27/2024, 12:40:44 PM
tid=2492a79efae279a29ec8a1a8dcb4c444

 【请求的 ip 】：172.200.199.170
 【 用  户 】 加了  642         个单词上限2024-07-27 14:42:10
######## 7/27/2024, 2:42:25 PM
tid=2492a79efae279a29ec8a1a8dcb4c444

 【请求的 ip 】：20.97.191.189
 【 用  户 】 加了  642         个单词上限2024-07-27 15:39:12
######## 7/27/2024, 3:39:26 PM
tid=2492a79efae279a29ec8a1a8dcb4c444

 【请求的 ip 】：20.97.191.96
 【 用  户 】 加了  642         个单词上限2024-07-27 17:39:26
######## 7/27/2024, 5:39:40 PM
tid=2492a79efae279a29ec8a1a8dcb4c444

 【请求的 ip 】：20.55.214.160
 【 用  户 】 加了  642         个单词上限2024-07-27 18:39:11
######## 7/27/2024, 6:39:25 PM
tid=2492a79efae279a29ec8a1a8dcb4c444

 【请求的 ip 】：20.55.47.60
 【 用  户 】 加了  642         个单词上限2024-07-28 12:39:50
######## 7/28/2024, 12:40:04 PM
tid=2492a79efae279a29ec8a1a8dcb4c444

 【请求的 ip 】：52.234.26.83
 【 用  户 】 加了  645         个单词上限2024-07-28 14:43:01
######## 7/28/2024, 2:43:14 PM
tid=2492a79efae279a29ec8a1a8dcb4c444

 【请求的 ip 】：172.183.131.131
 【 用  户 】 加了  645         个单词上限2024-07-28 15:39:12
######## 7/28/2024, 3:39:26 PM
tid=2492a79efae279a29ec8a1a8dcb4c444

 【请求的 ip 】：20.55.214.241
 【 用  户 】 加了  645         个单词上限2024-07-28 17:39:24
######## 7/28/2024, 5:39:37 PM
tid=2492a79efae279a29ec8a1a8dcb4c444

 【请求的 ip 】：52.234.33.249
 【 用  户 】 加了  645         个单词上限2024-07-28 18:39:29
######## 7/28/2024, 6:39:43 PM
tid=2492a79efae279a29ec8a1a8dcb4c444

 【请求的 ip 】：20.171.78.151
 【 用  户 】 加了  645         个单词上限2024-07-29 12:40:53
######## 7/29/2024, 12:41:07 PM
tid=2492a79efae279a29ec8a1a8dcb4c444

 【请求的 ip 】：74.249.14.176
 【 用  户 】 加了  645         个单词上限2024-07-29 14:43:04
######## 7/29/2024, 2:43:18 PM
tid=9723a90f37ed1968c8311ada1117b868

 【请求的 ip 】：20.172.28.141
 【 用  户 】 加了  648         个单词上限2024-07-29 15:39:29
######## 7/29/2024, 3:39:43 PM
tid=9723a90f37ed1968c8311ada1117b868

 【请求的 ip 】：20.161.78.40
 【 用  户 】 加了  648         个单词上限2024-07-29 17:39:14
######## 7/29/2024, 5:39:28 PM
tid=9723a90f37ed1968c8311ada1117b868

 【请求的 ip 】：40.71.163.79
 【 用  户 】 加了  648         个单词上限2024-07-29 18:41:17
######## 7/29/2024, 6:41:31 PM
tid=9723a90f37ed1968c8311ada1117b868

 【请求的 ip 】：20.49.55.103
 【 用  户 】 加了  648         个单词上限2024-07-30 12:41:02
######## 7/30/2024, 12:41:16 PM
tid=9440547a7f40bbc5cf96657f908a4ed7

 【请求的 ip 】：172.183.130.204
 【 用  户 】 加了  651         个单词上限2024-07-30 14:43:02
######## 7/30/2024, 2:43:16 PM
tid=9440547a7f40bbc5cf96657f908a4ed7

 【请求的 ip 】：172.183.122.149
 【 用  户 】 加了  651         个单词上限2024-07-30 15:39:13
######## 7/30/2024, 3:39:27 PM
tid=9440547a7f40bbc5cf96657f908a4ed7

 【请求的 ip 】：20.161.78.59
 【 用  户 】 加了  651         个单词上限2024-07-30 17:39:32
######## 7/30/2024, 5:39:46 PM
tid=9440547a7f40bbc5cf96657f908a4ed7

 【请求的 ip 】：172.183.98.201
 【 用  户 】 加了  651         个单词上限2024-07-30 18:41:01
######## 7/30/2024, 6:41:15 PM
tid=9440547a7f40bbc5cf96657f908a4ed7

 【请求的 ip 】：172.183.131.40
 【 用  户 】 加了  651         个单词上限2024-07-31 12:39:37
######## 7/31/2024, 12:39:51 PM
tid=9440547a7f40bbc5cf96657f908a4ed7

 【请求的 ip 】：20.55.15.80
 【 用  户 】 加了  651         个单词上限2024-07-31 14:39:36
######## 7/31/2024, 2:39:50 PM
tid=9440547a7f40bbc5cf96657f908a4ed7

 【请求的 ip 】：52.234.38.66
 【 用  户 】 加了  651         个单词上限2024-07-31 15:39:30
######## 7/31/2024, 3:39:44 PM
tid=9440547a7f40bbc5cf96657f908a4ed7

 【请求的 ip 】：74.249.14.161
 【 用  户 】 加了  651         个单词上限2024-07-31 17:39:12
######## 7/31/2024, 5:39:28 PM
tid=9440547a7f40bbc5cf96657f908a4ed7

 【请求的 ip 】：172.183.161.207
 【 用  户 】 加了  651         个单词上限2024-07-31 18:40:04
######## 7/31/2024, 6:40:17 PM
tid=d4d5dbc635c32b6fec2b438e3fbbff1d

 【请求的 ip 】：13.91.68.161
 【 用  户 】 加了  654         个单词上限2024-08-01 12:40:51
######## 8/1/2024, 12:41:05 PM
tid=d4d5dbc635c32b6fec2b438e3fbbff1d

 【请求的 ip 】：20.55.15.37
 【 用  户 】 加了  654         个单词上限2024-08-01 14:43:23
######## 8/1/2024, 2:43:37 PM
tid=d4d5dbc635c32b6fec2b438e3fbbff1d

 【请求的 ip 】：172.183.112.122
 【 用  户 】 加了  654         个单词上限2024-08-01 15:39:34
######## 8/1/2024, 3:39:49 PM
tid=d4d5dbc635c32b6fec2b438e3fbbff1d

 【请求的 ip 】：20.75.95.208
 【 用  户 】 加了  656         个单词上限2024-08-01 17:39:21
######## 8/1/2024, 5:39:35 PM
tid=d4d5dbc635c32b6fec2b438e3fbbff1d

 【请求的 ip 】：4.227.115.6
 【 用  户 】 加了  656         个单词上限2024-08-01 18:41:22
######## 8/1/2024, 6:41:36 PM
tid=d4d5dbc635c32b6fec2b438e3fbbff1d

 【请求的 ip 】：20.172.0.46
 【 用  户 】 加了  656         个单词上限2024-08-02 12:42:17
######## 8/2/2024, 12:42:31 PM
tid=ec5b7f9189dd1b3e05ac3d104843ec06

 【请求的 ip 】：20.51.198.166
 【 用  户 】 加了  659         个单词上限2024-08-02 14:44:48
######## 8/2/2024, 2:45:03 PM
tid=ec5b7f9189dd1b3e05ac3d104843ec06

 【请求的 ip 】：20.55.222.97
 【 用  户 】 加了  659         个单词上限2024-08-02 15:39:34
######## 8/2/2024, 3:39:50 PM
tid=ec5b7f9189dd1b3e05ac3d104843ec06

 【请求的 ip 】：40.67.141.246
 【 用  户 】 加了  659         个单词上限2024-08-02 17:39:25
######## 8/2/2024, 5:39:39 PM
tid=ec5b7f9189dd1b3e05ac3d104843ec06

 【请求的 ip 】：172.183.91.42
 【 用  户 】 加了  659         个单词上限2024-08-02 18:40:23
######## 8/2/2024, 6:40:37 PM
tid=ec5b7f9189dd1b3e05ac3d104843ec06

 【请求的 ip 】：20.172.46.72
 【 用  户 】 加了  659         个单词上限2024-08-03 12:40:30
######## 8/3/2024, 12:40:45 PM
tid=ec5b7f9189dd1b3e05ac3d104843ec06

 【请求的 ip 】：172.200.199.177
 【 用  户 】 加了  662         个单词上限2024-08-03 14:42:34
######## 8/3/2024, 2:42:50 PM
tid=ec5b7f9189dd1b3e05ac3d104843ec06

 【请求的 ip 】：20.75.95.194
 【 用  户 】 加了  662         个单词上限2024-08-03 15:39:30
######## 8/3/2024, 3:39:43 PM
tid=ec5b7f9189dd1b3e05ac3d104843ec06

 【请求的 ip 】：52.157.4.81
 【 用  户 】 加了  662         个单词上限2024-08-03 17:39:50
######## 8/3/2024, 5:40:04 PM
tid=ec5b7f9189dd1b3e05ac3d104843ec06

 【请求的 ip 】：172.183.82.223
 【 用  户 】 加了  662         个单词上限2024-08-03 18:39:22
######## 8/3/2024, 6:39:37 PM
tid=ec5b7f9189dd1b3e05ac3d104843ec06

 【请求的 ip 】：172.183.107.18
 【 用  户 】 加了  662         个单词上限2024-08-04 12:42:24
######## 8/4/2024, 12:42:39 PM
tid=ec5b7f9189dd1b3e05ac3d104843ec06

 【请求的 ip 】：20.171.122.187
 【 用  户 】 加了  662         个单词上限2024-08-04 14:41:45
######## 8/4/2024, 2:41:59 PM
tid=ec5b7f9189dd1b3e05ac3d104843ec06

 【请求的 ip 】：52.234.38.240
 【 用  户 】 加了  662         个单词上限2024-08-04 15:39:15
######## 8/4/2024, 3:39:29 PM
tid=78f28a5ba7e5ae4aaa66b09df935e09b

 【请求的 ip 】：40.67.141.245
 【 用  户 】 加了  665         个单词上限2024-08-04 17:39:34
######## 8/4/2024, 5:39:48 PM
tid=78f28a5ba7e5ae4aaa66b09df935e09b

 【请求的 ip 】：20.51.159.34
 【 用  户 】 加了  665         个单词上限2024-08-04 18:39:12
######## 8/4/2024, 6:39:26 PM
tid=78f28a5ba7e5ae4aaa66b09df935e09b

 【请求的 ip 】：172.183.52.206
 【 用  户 】 加了  665         个单词上限2024-08-05 12:41:08
######## 8/5/2024, 12:41:22 PM
tid=78f28a5ba7e5ae4aaa66b09df935e09b

 【请求的 ip 】：172.183.82.219
 【 用  户 】 加了  665         个单词上限2024-08-05 14:43:32
######## 8/5/2024, 2:43:46 PM
tid=78f28a5ba7e5ae4aaa66b09df935e09b

 【请求的 ip 】：172.190.111.146
 【 用  户 】 加了  665         个单词上限2024-08-05 15:39:19
######## 8/5/2024, 3:39:32 PM
tid=ece97e0add7f3aa8dd45d24736814e70

 【请求的 ip 】：13.91.69.162
 【 用  户 】 加了  668         个单词上限2024-08-05 17:39:15
######## 8/5/2024, 5:39:29 PM
tid=ece97e0add7f3aa8dd45d24736814e70

 【请求的 ip 】：20.172.6.175
 【 用  户 】 加了  668         个单词上限2024-08-05 18:40:45
######## 8/5/2024, 6:41:00 PM
tid=ece97e0add7f3aa8dd45d24736814e70

 【请求的 ip 】：20.102.46.247
 【 用  户 】 加了  668         个单词上限2024-08-06 12:42:22
######## 8/6/2024, 12:42:37 PM
tid=ece97e0add7f3aa8dd45d24736814e70

 【请求的 ip 】：172.190.111.156
 【 用  户 】 加了  668         个单词上限2024-08-06 14:43:58
######## 8/6/2024, 2:44:13 PM
tid=4bd424318e29ec390622f6641dc738fa

 【请求的 ip 】：20.97.191.53
 【 用  户 】 加了  671         个单词上限2024-08-06 15:39:29
######## 8/6/2024, 3:39:43 PM
tid=4bd424318e29ec390622f6641dc738fa

 【请求的 ip 】：20.55.46.193
 【 用  户 】 加了  671         个单词上限2024-08-06 17:39:31
######## 8/6/2024, 5:39:44 PM
tid=4bd424318e29ec390622f6641dc738fa

 【请求的 ip 】：52.238.27.210
 【 用  户 】 加了  671         个单词上限2024-08-06 18:41:36
######## 8/6/2024, 6:41:50 PM
tid=4bd424318e29ec390622f6641dc738fa

 【请求的 ip 】：74.249.5.98
 【 用  户 】 加了  671         个单词上限2024-08-07 12:41:55
######## 8/7/2024, 12:42:09 PM
tid=14850b1e3d1dd5ab8aeba8a6aa1cc8c1

 【请求的 ip 】：52.232.165.92
 【 用  户 】 加了  674         个单词上限2024-08-07 14:44:58
######## 8/7/2024, 2:45:12 PM
tid=14850b1e3d1dd5ab8aeba8a6aa1cc8c1

 【请求的 ip 】：20.55.126.36
 【 用  户 】 加了  674         个单词上限2024-08-07 15:39:55
######## 8/7/2024, 3:40:09 PM
tid=14850b1e3d1dd5ab8aeba8a6aa1cc8c1

 【请求的 ip 】：52.234.40.27
 【 用  户 】 加了  674         个单词上限2024-08-07 17:39:25
######## 8/7/2024, 5:39:39 PM
tid=14850b1e3d1dd5ab8aeba8a6aa1cc8c1

 【请求的 ip 】：172.183.107.18
 【 用  户 】 加了  674         个单词上限2024-08-07 18:40:41
######## 8/7/2024, 6:40:55 PM
tid=14850b1e3d1dd5ab8aeba8a6aa1cc8c1

 【请求的 ip 】：20.55.14.173
 【 用  户 】 加了  674         个单词上限2024-08-08 12:42:09
######## 8/8/2024, 12:42:23 PM
tid=14850b1e3d1dd5ab8aeba8a6aa1cc8c1

 【请求的 ip 】：172.183.84.71
 【 用  户 】 加了  674         个单词上限2024-08-08 14:43:31
######## 8/8/2024, 2:43:45 PM
tid=14850b1e3d1dd5ab8aeba8a6aa1cc8c1

 【请求的 ip 】：172.183.108.33
 【 用  户 】 加了  674         个单词上限2024-08-08 15:39:27
######## 8/8/2024, 3:39:41 PM
tid=14850b1e3d1dd5ab8aeba8a6aa1cc8c1

 【请求的 ip 】：40.67.133.147
 【 用  户 】 加了  674         个单词上限2024-08-08 17:39:19
######## 8/8/2024, 5:39:34 PM
tid=14850b1e3d1dd5ab8aeba8a6aa1cc8c1

 【请求的 ip 】：20.55.223.40
 【 用  户 】 加了  674         个单词上限2024-08-08 18:40:39
######## 8/8/2024, 6:40:52 PM
tid=374b83ccb33eed3e74abd6475d80c641

 【请求的 ip 】：13.91.68.162
 【 用  户 】 加了  677         个单词上限2024-08-09 12:41:24
######## 8/9/2024, 12:41:39 PM
tid=374b83ccb33eed3e74abd6475d80c641

 【请求的 ip 】：172.183.113.199
 【 用  户 】 加了  677         个单词上限2024-08-09 14:44:07
######## 8/9/2024, 2:44:22 PM
tid=20fd861ad389945a983064304c7f041a

 【请求的 ip 】：20.51.159.39
 【 用  户 】 加了  679         个单词上限2024-08-09 15:39:28
######## 8/9/2024, 3:39:42 PM
tid=20fd861ad389945a983064304c7f041a

 【请求的 ip 】：20.102.46.218
 【 用  户 】 加了  679         个单词上限2024-08-09 17:39:13
######## 8/9/2024, 5:39:27 PM
tid=20fd861ad389945a983064304c7f041a

 【请求的 ip 】：20.109.38.205
 【 用  户 】 加了  679         个单词上限2024-08-09 18:40:53
######## 8/9/2024, 6:41:07 PM
tid=20fd861ad389945a983064304c7f041a

 【请求的 ip 】：20.102.46.149
 【 用  户 】 加了  679         个单词上限2024-08-10 12:43:32
######## 8/10/2024, 12:43:45 PM
tid=20fd861ad389945a983064304c7f041a

 【请求的 ip 】：52.234.33.183
 【 用  户 】 加了  681         个单词上限2024-08-10 14:42:52
######## 8/10/2024, 2:43:07 PM
tid=20fd861ad389945a983064304c7f041a

 【请求的 ip 】：74.249.13.128
 【 用  户 】 加了  681         个单词上限2024-08-10 15:39:16
######## 8/10/2024, 3:39:30 PM
tid=20fd861ad389945a983064304c7f041a

 【请求的 ip 】：20.172.6.211
 【 用  户 】 加了  681         个单词上限2024-08-10 17:39:21
######## 8/10/2024, 5:39:35 PM
tid=20fd861ad389945a983064304c7f041a

 【请求的 ip 】：172.214.252.32
 【 用  户 】 加了  681         个单词上限2024-08-10 18:40:11
######## 8/10/2024, 6:40:26 PM
tid=20fd861ad389945a983064304c7f041a

 【请求的 ip 】：20.81.159.18
 【 用  户 】 加了  681         个单词上限2024-08-11 12:41:02
######## 8/11/2024, 12:41:16 PM
tid=91b90bdeec3f79ad32d1236de5cc394b

 【请求的 ip 】：20.109.39.133
 【 用  户 】 加了  684         个单词上限2024-08-11 14:42:27
######## 8/11/2024, 2:42:42 PM
tid=91b90bdeec3f79ad32d1236de5cc394b

 【请求的 ip 】：20.161.78.51
 【 用  户 】 加了  684         个单词上限2024-08-11 15:39:20
######## 8/11/2024, 3:39:34 PM
tid=91b90bdeec3f79ad32d1236de5cc394b

 【请求的 ip 】：20.51.159.47
 【 用  户 】 加了  684         个单词上限2024-08-11 17:39:15
######## 8/11/2024, 5:39:29 PM
tid=91b90bdeec3f79ad32d1236de5cc394b

 【请求的 ip 】：4.242.241.141
 【 用  户 】 加了  684         个单词上限2024-08-11 18:39:50
######## 8/11/2024, 6:40:03 PM
tid=91b90bdeec3f79ad32d1236de5cc394b

 【请求的 ip 】：52.238.27.209
 【 用  户 】 加了  684         个单词上限2024-08-12 12:41:33
######## 8/12/2024, 12:41:47 PM
tid=91b90bdeec3f79ad32d1236de5cc394b

 【请求的 ip 】：74.249.13.179
 【 用  户 】 加了  684         个单词上限2024-08-12 14:43:36
######## 8/12/2024, 2:43:50 PM
tid=91b90bdeec3f79ad32d1236de5cc394b

 【请求的 ip 】：74.249.13.142
 【 用  户 】 加了  684         个单词上限2024-08-12 15:39:28
######## 8/12/2024, 3:39:42 PM
tid=91b90bdeec3f79ad32d1236de5cc394b

 【请求的 ip 】：20.171.122.32
 【 用  户 】 加了  684         个单词上限2024-08-12 17:39:20
######## 8/12/2024, 5:39:34 PM
tid=91b90bdeec3f79ad32d1236de5cc394b

 【请求的 ip 】：20.97.191.38
 【 用  户 】 加了  684         个单词上限2024-08-12 18:41:30
######## 8/12/2024, 6:41:44 PM
tid=91b90bdeec3f79ad32d1236de5cc394b

 【请求的 ip 】：52.157.14.194
 【 用  户 】 加了  684         个单词上限2024-08-13 12:41:09
######## 8/13/2024, 12:41:22 PM
tid=1e5bb00f88b921b0ea83f4fc183af8dd

 【请求的 ip 】：20.102.214.33
 【 用  户 】 加了  687         个单词上限2024-08-13 14:44:06
######## 8/13/2024, 2:44:20 PM
tid=1e5bb00f88b921b0ea83f4fc183af8dd

 【请求的 ip 】：172.183.82.192
 【 用  户 】 加了  687         个单词上限2024-08-13 15:39:50
######## 8/13/2024, 3:40:04 PM
tid=1e5bb00f88b921b0ea83f4fc183af8dd

 【请求的 ip 】：20.55.15.47
 【 用  户 】 加了  687         个单词上限2024-08-13 17:40:03
######## 8/13/2024, 5:40:16 PM
tid=64e24a9585e8d235993827eb2a1c842a

 【请求的 ip 】：172.183.132.16
 【 用  户 】 加了  690         个单词上限2024-08-13 18:41:45
######## 8/13/2024, 6:41:59 PM
tid=64e24a9585e8d235993827eb2a1c842a

 【请求的 ip 】：20.97.189.17
 【 用  户 】 加了  690         个单词上限2024-08-14 12:41:11
######## 8/14/2024, 12:41:25 PM
tid=54882ff2f6d1b7d47e2a808a11164099

 【请求的 ip 】：20.51.207.129
 【 用  户 】 加了  692         个单词上限2024-08-14 14:42:58
######## 8/14/2024, 2:43:12 PM
tid=54882ff2f6d1b7d47e2a808a11164099

 【请求的 ip 】：20.55.118.209
 【 用  户 】 加了  692         个单词上限2024-08-14 15:39:21
######## 8/14/2024, 3:39:33 PM
tid=54882ff2f6d1b7d47e2a808a11164099

 【请求的 ip 】：20.253.152.177
 【 用  户 】 加了  692         个单词上限2024-08-14 17:39:14
######## 8/14/2024, 5:39:27 PM
tid=54882ff2f6d1b7d47e2a808a11164099

 【请求的 ip 】：20.109.39.179
 【 用  户 】 加了  692         个单词上限2024-08-14 18:41:06
######## 8/14/2024, 6:41:21 PM
tid=54882ff2f6d1b7d47e2a808a11164099

 【请求的 ip 】：20.161.78.231
 【 用  户 】 加了  692         个单词上限2024-08-15 12:41:40
######## 8/15/2024, 12:41:55 PM
tid=54882ff2f6d1b7d47e2a808a11164099

 【请求的 ip 】：20.57.14.21
 【 用  户 】 加了  692         个单词上限2024-08-15 14:44:16
######## 8/15/2024, 2:44:29 PM
tid=54882ff2f6d1b7d47e2a808a11164099

 【请求的 ip 】：13.87.243.38
 【 用  户 】 加了  692         个单词上限2024-08-15 15:39:45
######## 8/15/2024, 3:39:59 PM
tid=54882ff2f6d1b7d47e2a808a11164099

 【请求的 ip 】：172.183.154.109
 【 用  户 】 加了  692         个单词上限2024-08-15 17:39:12
######## 8/15/2024, 5:39:25 PM
tid=54882ff2f6d1b7d47e2a808a11164099

 【请求的 ip 】：172.183.131.202
 【 用  户 】 加了  692         个单词上限2024-08-15 18:41:44
######## 8/15/2024, 6:41:59 PM
tid=54882ff2f6d1b7d47e2a808a11164099

 【请求的 ip 】：172.183.53.180
 【 用  户 】 加了  692         个单词上限2024-08-16 12:41:08
######## 8/16/2024, 12:41:22 PM
tid=54882ff2f6d1b7d47e2a808a11164099

 【请求的 ip 】：52.234.33.178
 【 用  户 】 加了  695         个单词上限2024-08-16 14:43:21
######## 8/16/2024, 2:43:36 PM
tid=54882ff2f6d1b7d47e2a808a11164099

 【请求的 ip 】：172.183.37.89
 【 用  户 】 加了  695         个单词上限2024-08-16 15:39:30
######## 8/16/2024, 3:39:44 PM
tid=453d2905a7f981107f26b85145fa539f

 【请求的 ip 】：172.206.110.211
 【 用  户 】 加了  695         个单词上限2024-08-16 17:39:26
######## 8/16/2024, 5:39:42 PM
tid=453d2905a7f981107f26b85145fa539f

 【请求的 ip 】：172.183.131.30
 【 用  户 】 加了  695         个单词上限2024-08-16 18:40:57
######## 8/16/2024, 6:41:11 PM
tid=453d2905a7f981107f26b85145fa539f

 【请求的 ip 】：20.12.6.220
 【 用  户 】 加了  695         个单词上限2024-08-17 12:41:16
######## 8/17/2024, 12:41:29 PM
tid=362112b2a378803cc3819c703e4d2070

 【请求的 ip 】：20.171.78.148
 【 用  户 】 加了  698         个单词上限2024-08-17 14:41:18
######## 8/17/2024, 2:41:32 PM
tid=362112b2a378803cc3819c703e4d2070

 【请求的 ip 】：20.97.189.18
 【 用  户 】 加了  698         个单词上限2024-08-17 15:39:11
######## 8/17/2024, 3:39:25 PM
tid=362112b2a378803cc3819c703e4d2070

 【请求的 ip 】：172.183.74.5
 【 用  户 】 加了  698         个单词上限2024-08-17 17:39:18
######## 8/17/2024, 5:39:31 PM
tid=362112b2a378803cc3819c703e4d2070

 【请求的 ip 】：40.76.119.2
 【 用  户 】 加了  698         个单词上限2024-08-17 18:40:21
######## 8/17/2024, 6:40:34 PM
tid=362112b2a378803cc3819c703e4d2070

 【请求的 ip 】：20.172.46.70
 【 用  户 】 加了  698         个单词上限2024-08-18 11:55:46
######## 8/18/2024, 11:56:01 AM
tid=362112b2a378803cc3819c703e4d2070

 【请求的 ip 】：20.81.159.83
 【 用  户 】 加了  698         个单词上限2024-08-18 12:41:16
######## 8/18/2024, 12:41:30 PM
tid=1e213d53d69c2db229205896810d68e2

 【请求的 ip 】：172.183.88.184
 【 用  户 】 加了  701         个单词上限2024-08-18 14:41:56
######## 8/18/2024, 2:42:09 PM
tid=1e213d53d69c2db229205896810d68e2

 【请求的 ip 】：52.234.38.75
 【 用  户 】 加了  701         个单词上限2024-08-18 15:39:14
######## 8/18/2024, 3:39:29 PM
tid=1e213d53d69c2db229205896810d68e2

 【请求的 ip 】：20.55.118.240
 【 用  户 】 加了  701         个单词上限2024-08-18 17:39:22
######## 8/18/2024, 5:39:36 PM
tid=1e213d53d69c2db229205896810d68e2

 【请求的 ip 】：172.200.199.169
 【 用  户 】 加了  701         个单词上限2024-08-18 18:39:29
######## 8/18/2024, 6:39:43 PM
tid=1e213d53d69c2db229205896810d68e2

 【请求的 ip 】：172.183.130.193
 【 用  户 】 加了  701         个单词上限2024-08-19 12:41:05
######## 8/19/2024, 12:41:18 PM
tid=aed5f4c780ab3f76b5b9fd2ecd0d99e6

 【请求的 ip 】：172.183.50.149
 【 用  户 】 加了  704         个单词上限2024-08-19 14:44:04
######## 8/19/2024, 2:44:18 PM
tid=aed5f4c780ab3f76b5b9fd2ecd0d99e6

 【请求的 ip 】：20.109.38.150
 【 用  户 】 加了  704         个单词上限2024-08-19 15:39:35
######## 8/19/2024, 3:39:49 PM
tid=aed5f4c780ab3f76b5b9fd2ecd0d99e6

 【请求的 ip 】：20.161.61.210
 【 用  户 】 加了  704         个单词上限2024-08-19 17:39:20
######## 8/19/2024, 5:39:33 PM
tid=aed5f4c780ab3f76b5b9fd2ecd0d99e6

 【请求的 ip 】：52.159.137.11
 【 用  户 】 加了  704         个单词上限2024-08-19 18:42:19
######## 8/19/2024, 6:42:33 PM
tid=aed5f4c780ab3f76b5b9fd2ecd0d99e6

 【请求的 ip 】：20.161.78.42
 【 用  户 】 加了  704         个单词上限2024-08-20 12:43:22
######## 8/20/2024, 12:43:35 PM
tid=aed5f4c780ab3f76b5b9fd2ecd0d99e6

 【请求的 ip 】：52.238.27.193
 【 用  户 】 加了  704         个单词上限2024-08-20 14:43:22
######## 8/20/2024, 2:43:36 PM
tid=aed5f4c780ab3f76b5b9fd2ecd0d99e6

 【请求的 ip 】：40.71.163.77
 【 用  户 】 加了  704         个单词上限2024-08-20 15:39:24
######## 8/20/2024, 3:39:39 PM
tid=aed5f4c780ab3f76b5b9fd2ecd0d99e6

 【请求的 ip 】：20.172.5.80
 【 用  户 】 加了  704         个单词上限2024-08-20 17:39:14
######## 8/20/2024, 5:39:28 PM
tid=aed5f4c780ab3f76b5b9fd2ecd0d99e6

 【请求的 ip 】：20.171.70.48
 【 用  户 】 加了  704         个单词上限2024-08-20 18:42:09
######## 8/20/2024, 6:42:23 PM
tid=aed5f4c780ab3f76b5b9fd2ecd0d99e6

 【请求的 ip 】：20.109.39.180
 【 用  户 】 加了  704         个单词上限2024-08-21 12:41:58
######## 8/21/2024, 12:42:11 PM
tid=aed5f4c780ab3f76b5b9fd2ecd0d99e6

 【请求的 ip 】：172.183.107.210
 【 用  户 】 加了  707         个单词上限2024-08-21 14:43:04
######## 8/21/2024, 2:43:17 PM
tid=04edb7bbbb329ee1e307b14c7e4d076f

 【请求的 ip 】：172.183.112.123
 【 用  户 】 加了  707         个单词上限2024-08-21 15:39:39
######## 8/21/2024, 3:39:54 PM
tid=04edb7bbbb329ee1e307b14c7e4d076f

 【请求的 ip 】：20.102.46.218
 【 用  户 】 加了  707         个单词上限2024-08-21 17:39:26
######## 8/21/2024, 5:39:39 PM
tid=04edb7bbbb329ee1e307b14c7e4d076f

 【请求的 ip 】：52.234.33.125
 【 用  户 】 加了  707         个单词上限2024-08-21 18:40:38
######## 8/21/2024, 6:40:51 PM
tid=04edb7bbbb329ee1e307b14c7e4d076f

 【请求的 ip 】：172.183.106.48
 【 用  户 】 加了  707         个单词上限2024-08-22 12:41:19
######## 8/22/2024, 12:41:32 PM
tid=04edb7bbbb329ee1e307b14c7e4d076f

 【请求的 ip 】：13.91.68.144
 【 用  户 】 加了  707         个单词上限2024-08-22 14:44:18
######## 8/22/2024, 2:44:31 PM
tid=04edb7bbbb329ee1e307b14c7e4d076f

 【请求的 ip 】：52.234.27.6
 【 用  户 】 加了  710         个单词上限2024-08-22 15:39:16
######## 8/22/2024, 3:39:31 PM
tid=04edb7bbbb329ee1e307b14c7e4d076f

 【请求的 ip 】：20.55.223.81
 【 用  户 】 加了  710         个单词上限2024-08-22 17:39:30
######## 8/22/2024, 5:39:43 PM
tid=04edb7bbbb329ee1e307b14c7e4d076f

 【请求的 ip 】：13.86.227.243
 【 用  户 】 加了  710         个单词上限2024-08-22 18:43:21
######## 8/22/2024, 6:43:34 PM
tid=04edb7bbbb329ee1e307b14c7e4d076f

 【请求的 ip 】：20.55.15.41
 【 用  户 】 加了  710         个单词上限2024-08-23 12:41:42
######## 8/23/2024, 12:41:56 PM
tid=4ceaf41083fcdc10ae65a8ffa5cd3606

 【请求的 ip 】：57.154.160.49
 【 用  户 】 加了  713         个单词上限2024-08-23 14:43:12
######## 8/23/2024, 2:43:26 PM
tid=4ceaf41083fcdc10ae65a8ffa5cd3606

 【请求的 ip 】：20.161.77.197
 【 用  户 】 加了  713         个单词上限2024-08-23 15:39:46
######## 8/23/2024, 3:39:59 PM
tid=4ceaf41083fcdc10ae65a8ffa5cd3606

 【请求的 ip 】：13.91.68.93
 【 用  户 】 加了  713         个单词上限2024-08-23 17:39:15
######## 8/23/2024, 5:39:28 PM
tid=4ceaf41083fcdc10ae65a8ffa5cd3606

 【请求的 ip 】：52.238.25.50
 【 用  户 】 加了  713         个单词上限2024-08-23 18:40:51
######## 8/23/2024, 6:41:05 PM
tid=4ceaf41083fcdc10ae65a8ffa5cd3606

 【请求的 ip 】：74.249.5.226
 【 用  户 】 加了  713         个单词上限2024-08-24 12:41:35
######## 8/24/2024, 12:41:49 PM
tid=4ceaf41083fcdc10ae65a8ffa5cd3606

 【请求的 ip 】：172.214.176.91
 【 用  户 】 加了  713         个单词上限2024-08-24 14:42:04
######## 8/24/2024, 2:42:17 PM
tid=4ceaf41083fcdc10ae65a8ffa5cd3606

 【请求的 ip 】：52.234.26.80
 【 用  户 】 加了  716         个单词上限2024-08-24 15:39:39
######## 8/24/2024, 3:39:53 PM
tid=4ceaf41083fcdc10ae65a8ffa5cd3606

 【请求的 ip 】：74.249.5.228
 【 用  户 】 加了  716         个单词上限2024-08-24 17:39:23
######## 8/24/2024, 5:39:37 PM
tid=4ceaf41083fcdc10ae65a8ffa5cd3606

 【请求的 ip 】：172.183.147.225
 【 用  户 】 加了  716         个单词上限2024-08-24 18:39:37
######## 8/24/2024, 6:39:53 PM
tid=4ceaf41083fcdc10ae65a8ffa5cd3606

 【请求的 ip 】：172.190.111.247
 【 用  户 】 加了  716         个单词上限2024-08-25 12:41:33
######## 8/25/2024, 12:41:47 PM
tid=4ceaf41083fcdc10ae65a8ffa5cd3606

 【请求的 ip 】：172.183.113.197
 【 用  户 】 加了  719         个单词上限2024-08-25 14:42:31
######## 8/25/2024, 2:42:46 PM
tid=4ceaf41083fcdc10ae65a8ffa5cd3606

 【请求的 ip 】：20.55.126.45
 【 用  户 】 加了  719         个单词上限2024-08-25 15:39:15
######## 8/25/2024, 3:39:29 PM
tid=4ceaf41083fcdc10ae65a8ffa5cd3606

 【请求的 ip 】：172.183.146.93
 【 用  户 】 加了  719         个单词上限2024-08-25 17:39:25
######## 8/25/2024, 5:39:38 PM
tid=4ceaf41083fcdc10ae65a8ffa5cd3606

 【请求的 ip 】：13.91.68.223
 【 用  户 】 加了  719         个单词上限2024-08-25 18:40:23
######## 8/25/2024, 6:40:37 PM
tid=4ceaf41083fcdc10ae65a8ffa5cd3606

 【请求的 ip 】：172.183.112.119
 【 用  户 】 加了  719         个单词上限2024-08-26 12:43:46
######## 8/26/2024, 12:44:01 PM
tid=4ceaf41083fcdc10ae65a8ffa5cd3606

 【请求的 ip 】：172.183.98.202
 【 用  户 】 加了  719         个单词上限2024-08-26 14:44:09
######## 8/26/2024, 2:44:23 PM
tid=4ceaf41083fcdc10ae65a8ffa5cd3606

 【请求的 ip 】：20.172.43.101
 【 用  户 】 加了  719         个单词上限2024-08-26 15:39:56
######## 8/26/2024, 3:40:09 PM
tid=4ceaf41083fcdc10ae65a8ffa5cd3606

 【请求的 ip 】：172.183.154.102
 【 用  户 】 加了  719         个单词上限2024-08-26 17:39:25
######## 8/26/2024, 5:39:39 PM
tid=4ceaf41083fcdc10ae65a8ffa5cd3606

 【请求的 ip 】：172.183.106.48
 【 用  户 】 加了  719         个单词上限2024-08-26 18:43:13
######## 8/26/2024, 6:43:26 PM
tid=4ceaf41083fcdc10ae65a8ffa5cd3606

 【请求的 ip 】：172.182.232.58
 【 用  户 】 加了  719         个单词上限2025-10-09 00:06:40
######## 10/9/2025, 12:06:50 AM
tid=cf462b53624a46f86f61c0819a4bf6f0

 【请求的 ip 】：172.182.211.20
 【 用  户 】 加了  58         个单词上限2025-10-09 02:32:25
######## 10/9/2025, 2:32:35 AM
tid=c3d74ce225338e6eb916d8e2601fbda3，

 【请求的 ip 】：172.215.211.25
 【 用  户 】 加了  58         个单词上限2025-10-09 06:19:49
######## 10/9/2025, 6:19:58 AM
tid=c3d74ce225338e6eb916d8e2601fbda3，

 【请求的 ip 】：13.83.161.17
 【 用  户 】 加了  58         个单词上限2025-10-09 16:28:50
######## 10/9/2025, 4:29:00 PM
tid=c3d74ce225338e6eb916d8e2601fbda3，

 【请求的 ip 】：9.234.151.23
 【 用  户 】 加了  58         个单词上限2025-10-09 20:45:18
######## 10/9/2025, 8:45:28 PM
tid=c3d74ce225338e6eb916d8e2601fbda3，

 【请求的 ip 】：172.182.192.152
 【 用  户 】 加了  58         个单词上限2025-10-09 23:31:20
######## 10/9/2025, 11:31:31 PM
tid=cf462b53624a46f86f61c0819a4bf6f0

 【请求的 ip 】：52.161.59.150
 【 用  户 】 加了  58         个单词上限2025-10-10 02:30:56
######## 10/10/2025, 2:31:07 AM
tid=c3d74ce225338e6eb916d8e2601fbda3,

 【请求的 ip 】：135.232.224.80
 【 用  户 】 加了  58         个单词上限2025-10-10 06:19:20
######## 10/10/2025, 6:19:30 AM
tid=c3d74ce225338e6eb916d8e2601fbda3,

 【请求的 ip 】：172.214.44.215
 【 用  户 】 加了  58         个单词上限2025-10-10 16:28:23
######## 10/10/2025, 4:28:33 PM
tid=c3d74ce225338e6eb916d8e2601fbda3,

 【请求的 ip 】：20.55.214.119
 【 用  户 】 加了  58         个单词上限2025-10-10 20:43:41
######## 10/10/2025, 8:43:51 PM
tid=dfcf63ad7c524959b32498d2a5773226,

 【请求的 ip 】：52.173.163.39
 【 用  户 】 加了  58         个单词上限2025-10-10 23:21:24
######## 10/10/2025, 11:21:34 PM
tid=dfcf63ad7c524959b32498d2a5773226,

 【请求的 ip 】：172.184.174.121
 【 用  户 】 加了  58         个单词上限2025-10-11 02:30:30
######## 10/11/2025, 2:30:39 AM
tid=c3d74ce225338e6eb916d8e2601fbda3,

 【请求的 ip 】：172.215.217.96
 【 用  户 】 加了  59         个单词上限2025-10-11 06:18:52
######## 10/11/2025, 6:19:02 AM
tid=dfcf63ad7c524959b32498d2a5773226,

 【请求的 ip 】：68.154.37.68
 【 用  户 】 加了  59         个单词上限2025-10-11 16:25:04
######## 10/11/2025, 4:25:14 PM
tid=cf462b53624a46f86f61c0819a4bf6f0

 【请求的 ip 】：172.183.157.177
 【 用  户 】 加了  62         个单词上限2025-10-11 20:38:54
######## 10/11/2025, 8:39:04 PM
tid=dfcf63ad7c524959b32498d2a5773226,

 【请求的 ip 】：52.154.130.213
 【 用  户 】 加了  62         个单词上限2025-10-11 23:18:16
######## 10/11/2025, 11:18:26 PM
tid=b1b9613aca2cb69840f39197a660d742&uid=27304477&pid=2c1b84d61648ed636639877032f6c7e8,

 【请求的 ip 】：172.184.213.2262025-10-12 02:25:41
######## 10/12/2025, 2:25:51 AM
tid=b1b9613aca2cb69840f39197a660d742&uid=27304477&pid=2c1b84d61648ed636639877032f6c7e8,

 【请求的 ip 】：48.214.55.662025-10-12 06:18:17
######## 10/12/2025, 6:18:28 AM
tid=dfcf63ad7c524959b32498d2a5773226,

 【请求的 ip 】：64.236.134.51
 【 用  户 】 加了  62         个单词上限2025-10-12 16:25:09
######## 10/12/2025, 4:25:19 PM
tid=dfcf63ad7c524959b32498d2a5773226,

 【请求的 ip 】：52.238.24.35
 【 用  户 】 加了  62         个单词上限2025-10-12 20:39:14
######## 10/12/2025, 8:39:25 PM
tid=dfcf63ad7c524959b32498d2a5773226,

 【请求的 ip 】：145.132.103.179
 【 用  户 】 加了  62         个单词上限2025-10-12 23:18:58
######## 10/12/2025, 11:19:08 PM
tid=dfcf63ad7c524959b32498d2a5773226,

 【请求的 ip 】：68.220.59.49
 【 用  户 】 加了  62         个单词上限2025-10-13 02:27:09
######## 10/13/2025, 2:27:19 AM
tid=dfcf63ad7c524959b32498d2a5773226,

 【请求的 ip 】：48.214.53.85
 【 用  户 】 加了  62         个单词上限2025-10-13 06:18:49
######## 10/13/2025, 6:18:59 AM
tid=b1b9613aca2cb69840f39197a660d742&uid=27304477&pid=2c1b84d61648ed636639877032f6c7e8,

 【请求的 ip 】：20.109.87.1142025-10-13 16:31:35
######## 10/13/2025, 4:31:45 PM
tid=dfcf63ad7c524959b32498d2a5773226,

 【请求的 ip 】：4.236.158.85
 【 用  户 】 加了  62         个单词上限2025-10-13 20:45:36
######## 10/13/2025, 8:45:46 PM
tid=b1b9613aca2cb69840f39197a660d742&uid=27304477&pid=2c1b84d61648ed636639877032f6c7e8,

 【请求的 ip 】：145.132.99.242025-10-13 23:22:17
######## 10/13/2025, 11:22:27 PM
tid=b1b9613aca2cb69840f39197a660d742&uid=27304477&pid=2c1b84d61648ed636639877032f6c7e8,

 【请求的 ip 】：4.246.135.1932025-10-14 02:30:09
######## 10/14/2025, 2:30:19 AM
tid=dfcf63ad7c524959b32498d2a5773226,

 【请求的 ip 】：57.151.128.247
 【 用  户 】 加了  64         个单词上限2025-10-14 06:19:18
######## 10/14/2025, 6:19:28 AM
tid=b1b9613aca2cb69840f39197a660d742&uid=27304477&pid=2c1b84d61648ed636639877032f6c7e8,

 【请求的 ip 】：64.236.200.2252025-10-14 16:27:39
######## 10/14/2025, 4:27:49 PM
tid=b1b9613aca2cb69840f39197a660d742&uid=27304477&pid=2c1b84d61648ed636639877032f6c7e8,

 【请求的 ip 】：172.215.217.2462025-10-14 20:48:29
######## 10/14/2025, 8:48:39 PM
tid=dfcf63ad7c524959b32498d2a5773226,

 【请求的 ip 】：172.184.191.162
 【 用  户 】 加了  64         个单词上限2025-10-14 23:24:31
######## 10/14/2025, 11:24:41 PM
tid=dfcf63ad7c524959b32498d2a5773226,

 【请求的 ip 】：20.55.222.85
 【 用  户 】 加了  64         个单词上限2025-10-15 02:31:44
######## 10/15/2025, 2:31:54 AM
tid=b1b9613aca2cb69840f39197a660d742&uid=27304477&pid=2c1b84d61648ed636639877032f6c7e8,

 【请求的 ip 】：135.232.176.1622025-10-15 06:20:09
######## 10/15/2025, 6:20:19 AM
tid=b1b9613aca2cb69840f39197a660d742&uid=27304477&pid=2c1b84d61648ed636639877032f6c7e8,

 【请求的 ip 】：172.182.213.32025-10-15 16:30:47
######## 10/15/2025, 4:30:57 PM
tid=b1b9613aca2cb69840f39197a660d742&uid=27304477&pid=2c1b84d61648ed636639877032f6c7e8,

 【请求的 ip 】：64.236.201.502025-10-15 20:47:53
######## 10/15/2025, 8:48:03 PM
tid=dfcf63ad7c524959b32498d2a5773226,

 【请求的 ip 】：20.55.15.97
 【 用  户 】 加了  65         个单词上限2025-10-15 23:21:09
######## 10/15/2025, 11:21:23 PM
tid=b1b9613aca2cb69840f39197a660d742&uid=27304477&pid=2c1b84d61648ed636639877032f6c7e8,

 【请求的 ip 】：4.236.159.2262025-10-16 02:32:50
######## 10/16/2025, 2:33:01 AM
tid=b1b9613aca2cb69840f39197a660d742&uid=27304477&pid=2c1b84d61648ed636639877032f6c7e8,

 【请求的 ip 】：20.81.159.372025-10-16 06:18:45
######## 10/16/2025, 6:18:55 AM
tid=dfcf63ad7c524959b32498d2a5773226,

 【请求的 ip 】：20.109.95.102
 【 用  户 】 加了  68         个单词上限2025-10-16 16:30:52
######## 10/16/2025, 4:31:02 PM
tid=dfcf63ad7c524959b32498d2a5773226,

 【请求的 ip 】：74.249.79.56
 【 用  户 】 加了  68         个单词上限2025-10-16 20:47:45
######## 10/16/2025, 8:47:55 PM
tid=dfcf63ad7c524959b32498d2a5773226,

 【请求的 ip 】：74.235.126.81
 【 用  户 】 加了  68         个单词上限2025-10-16 23:23:40
######## 10/16/2025, 11:23:50 PM
tid=dfcf63ad7c524959b32498d2a5773226,

 【请求的 ip 】：52.173.108.26
 【 用  户 】 加了  68         个单词上限2025-10-17 02:31:45
######## 10/17/2025, 2:31:55 AM
tid=dfcf63ad7c524959b32498d2a5773226,

 【请求的 ip 】：172.184.220.212
 【 用  户 】 加了  69         个单词上限2025-10-17 06:17:07
######## 10/17/2025, 6:17:17 AM
tid=b1b9613aca2cb69840f39197a660d742&uid=27304477&pid=2c1b84d61648ed636639877032f6c7e8,

 【请求的 ip 】：172.182.193.1342025-10-17 16:29:52
######## 10/17/2025, 4:30:02 PM
tid=f8bc5cb417b772d621749a23669f3429

 【请求的 ip 】：48.211.212.213
 【 用  户 】 加了  71         个单词上限2025-10-17 20:44:45
######## 10/17/2025, 8:44:55 PM
tid=f8bc5cb417b772d621749a23669f3429

 【请求的 ip 】：172.214.44.55
 【 用  户 】 加了  71         个单词上限2025-10-17 23:21:42
######## 10/17/2025, 11:21:52 PM
tid=f8bc5cb417b772d621749a23669f3429

 【请求的 ip 】：64.236.192.152
 【 用  户 】 加了  71         个单词上限2025-10-18 02:28:42
######## 10/18/2025, 2:28:53 AM
tid=f8bc5cb417b772d621749a23669f3429

 【请求的 ip 】：172.172.158.1
 【 用  户 】 加了  71         个单词上限2025-10-18 06:19:19
######## 10/18/2025, 6:19:29 AM
tid=f8bc5cb417b772d621749a23669f3429

 【请求的 ip 】：48.217.140.228
 【 用  户 】 加了  71         个单词上限2025-10-18 16:26:09
######## 10/18/2025, 4:26:19 PM
tid=f8bc5cb417b772d621749a23669f3429

 【请求的 ip 】：64.236.131.209
 【 用  户 】 加了  71         个单词上限2025-10-18 20:39:53
######## 10/18/2025, 8:40:03 PM
tid=f8bc5cb417b772d621749a23669f3429

 【请求的 ip 】：172.212.163.24
 【 用  户 】 加了  71         个单词上限2025-10-18 23:18:54
######## 10/18/2025, 11:19:04 PM
tid=f8bc5cb417b772d621749a23669f3429

 【请求的 ip 】：135.232.216.52
 【 用  户 】 加了  71         个单词上限2025-10-19 02:27:28
######## 10/19/2025, 2:27:38 AM
tid=f8bc5cb417b772d621749a23669f3429

 【请求的 ip 】：64.236.140.195
 【 用  户 】 加了  74         个单词上限2025-10-19 06:18:36
######## 10/19/2025, 6:18:47 AM
tid=f8bc5cb417b772d621749a23669f3429

 【请求的 ip 】：135.232.200.211
 【 用  户 】 加了  74         个单词上限2025-10-19 16:25:07
######## 10/19/2025, 4:25:17 PM
tid=f8bc5cb417b772d621749a23669f3429

 【请求的 ip 】：68.220.63.3
 【 用  户 】 加了  74         个单词上限2025-10-19 20:39:59
######## 10/19/2025, 8:40:08 PM
tid=f8bc5cb417b772d621749a23669f3429

 【请求的 ip 】：128.24.161.184
 【 用  户 】 加了  74         个单词上限2025-10-19 23:19:07
######## 10/19/2025, 11:19:17 PM
tid=f8bc5cb417b772d621749a23669f3429

 【请求的 ip 】：40.76.117.229
 【 用  户 】 加了  74         个单词上限2025-10-20 02:27:59
######## 10/20/2025, 2:28:09 AM
tid=f8bc5cb417b772d621749a23669f3429

 【请求的 ip 】：172.184.219.161
 【 用  户 】 加了  77         个单词上限2025-10-20 06:19:30
######## 10/20/2025, 6:19:40 AM
tid=f8bc5cb417b772d621749a23669f3429

 【请求的 ip 】：104.209.11.20
 【 用  户 】 加了  77         个单词上限2025-10-20 16:36:56
######## 10/20/2025, 4:37:06 PM
tid=f8bc5cb417b772d621749a23669f3429

 【请求的 ip 】：48.214.53.87
 【 用  户 】 加了  77         个单词上限2025-10-20 20:46:40
######## 10/20/2025, 8:46:50 PM
tid=f8bc5cb417b772d621749a23669f3429

 【请求的 ip 】：64.236.169.130
 【 用  户 】 加了  77         个单词上限2025-10-20 23:22:30
######## 10/20/2025, 11:22:40 PM
tid=f8bc5cb417b772d621749a23669f3429

 【请求的 ip 】：172.177.209.213
 【 用  户 】 加了  77         个单词上限2025-10-21 02:32:49
######## 10/21/2025, 2:32:59 AM
tid=f8bc5cb417b772d621749a23669f3429

 【请求的 ip 】：20.55.214.72
 【 用  户 】 加了  79         个单词上限2025-10-21 06:19:57
######## 10/21/2025, 6:20:09 AM
tid=f8bc5cb417b772d621749a23669f3429

 【请求的 ip 】：135.119.235.87
 【 用  户 】 加了  79         个单词上限2025-10-21 16:31:45
######## 10/21/2025, 4:31:56 PM
tid=f8bc5cb417b772d621749a23669f3429

 【请求的 ip 】：64.236.169.113
 【 用  户 】 加了  82         个单词上限2025-10-21 20:48:17
######## 10/21/2025, 8:48:27 PM
tid=f8bc5cb417b772d621749a23669f3429

 【请求的 ip 】：74.235.123.0
 【 用  户 】 加了  82         个单词上限2025-10-21 23:22:16
######## 10/21/2025, 11:22:26 PM
tid=f8bc5cb417b772d621749a23669f3429

 【请求的 ip 】：52.173.237.209
 【 用  户 】 加了  82         个单词上限2025-10-22 02:31:43
######## 10/22/2025, 2:31:53 AM
tid=f8bc5cb417b772d621749a23669f3429

 【请求的 ip 】：135.232.208.137
 【 用  户 】 加了  82         个单词上限2025-10-22 06:18:38
######## 10/22/2025, 6:18:48 AM
tid=f8bc5cb417b772d621749a23669f3429

 【请求的 ip 】：52.173.181.24
 【 用  户 】 加了  82         个单词上限2025-10-22 16:32:27
######## 10/22/2025, 4:32:38 PM
tid=f8bc5cb417b772d621749a23669f3429

 【请求的 ip 】：4.236.159.231
 【 用  户 】 加了  82         个单词上限2025-10-22 20:48:41
######## 10/22/2025, 8:48:52 PM
tid=f8bc5cb417b772d621749a23669f3429

 【请求的 ip 】：4.227.135.146
 【 用  户 】 加了  82         个单词上限2025-10-22 23:22:53
######## 10/22/2025, 11:23:04 PM
tid=f8bc5cb417b772d621749a23669f3429

 【请求的 ip 】：172.182.195.233
 【 用  户 】 加了  82         个单词上限2025-10-23 02:33:29
######## 10/23/2025, 2:33:39 AM
tid=f8bc5cb417b772d621749a23669f3429

 【请求的 ip 】：52.173.182.161
 【 用  户 】 加了  82         个单词上限2025-10-23 06:17:12
######## 10/23/2025, 6:17:23 AM
tid=f8bc5cb417b772d621749a23669f3429

 【请求的 ip 】：52.176.138.196
 【 用  户 】 加了  84         个单词上限2025-10-23 16:30:40
######## 10/23/2025, 4:30:50 PM
tid=f8bc5cb417b772d621749a23669f3429

 【请求的 ip 】：52.165.251.167
 【 用  户 】 加了  84         个单词上限2025-10-23 20:48:29
######## 10/23/2025, 8:48:39 PM
tid=f8bc5cb417b772d621749a23669f3429

 【请求的 ip 】：68.154.54.103
 【 用  户 】 加了  84         个单词上限2025-10-23 23:23:45
######## 10/23/2025, 11:23:55 PM
tid=f8bc5cb417b772d621749a23669f3429

 【请求的 ip 】：52.234.43.184
 【 用  户 】 加了  84         个单词上限2025-10-24 02:32:03
######## 10/24/2025, 2:32:13 AM
tid=f8bc5cb417b772d621749a23669f3429

 【请求的 ip 】：64.236.177.99
 【 用  户 】 加了  84         个单词上限2025-10-24 06:19:48
######## 10/24/2025, 6:19:58 AM
tid=f8bc5cb417b772d621749a23669f3429

 【请求的 ip 】：172.184.209.150
 【 用  户 】 加了  84         个单词上限2025-10-24 16:29:38
######## 10/24/2025, 4:29:47 PM
tid=f8bc5cb417b772d621749a23669f3429

 【请求的 ip 】：20.168.110.181
 【 用  户 】 加了  84         个单词上限2025-10-24 20:48:04
######## 10/24/2025, 8:48:14 PM
tid=f8bc5cb417b772d621749a23669f3429

 【请求的 ip 】：172.182.225.197
 【 用  户 】 加了  84         个单词上限2025-10-24 23:23:32
######## 10/24/2025, 11:23:42 PM
tid=f8bc5cb417b772d621749a23669f3429

 【请求的 ip 】：145.132.102.52
 【 用  户 】 加了  84         个单词上限2025-10-25 02:29:54
######## 10/25/2025, 2:30:04 AM
tid=f8bc5cb417b772d621749a23669f3429

 【请求的 ip 】：52.159.225.202
 【 用  户 】 加了  87         个单词上限2025-10-25 06:20:18
######## 10/25/2025, 6:20:28 AM
tid=f8bc5cb417b772d621749a23669f3429

 【请求的 ip 】：52.225.73.164
 【 用  户 】 加了  87         个单词上限2025-10-25 16:25:18
######## 10/25/2025, 4:25:28 PM
tid=f8bc5cb417b772d621749a23669f3429

 【请求的 ip 】：20.109.95.173
 【 用  户 】 加了  87         个单词上限2025-10-25 20:39:46
######## 10/25/2025, 8:39:56 PM
tid=f8bc5cb417b772d621749a23669f3429

 【请求的 ip 】：9.234.151.83
 【 用  户 】 加了  87         个单词上限2025-10-25 23:19:10
######## 10/25/2025, 11:19:21 PM
tid=f8bc5cb417b772d621749a23669f3429

 【请求的 ip 】：172.182.225.85
 【 用  户 】 加了  87         个单词上限2025-10-26 02:28:19
######## 10/26/2025, 2:28:29 AM
tid=f8bc5cb417b772d621749a23669f3429

 【请求的 ip 】：20.168.110.20
 【 用  户 】 加了  89         个单词上限2025-10-26 06:18:39
######## 10/26/2025, 6:18:49 AM
tid=f8bc5cb417b772d621749a23669f3429

 【请求的 ip 】：172.182.225.3
 【 用  户 】 加了  89         个单词上限2025-10-26 16:25:45
######## 10/26/2025, 4:25:55 PM
tid=f8bc5cb417b772d621749a23669f3429

 【请求的 ip 】：52.173.181.23
 【 用  户 】 加了  89         个单词上限2025-10-26 20:41:03
######## 10/26/2025, 8:41:13 PM
tid=f8bc5cb417b772d621749a23669f3429

 【请求的 ip 】：145.132.99.17
 【 用  户 】 加了  89         个单词上限2025-10-26 23:19:39
######## 10/26/2025, 11:19:49 PM
tid=f8bc5cb417b772d621749a23669f3429

 【请求的 ip 】：135.232.232.16
 【 用  户 】 加了  89         个单词上限2025-10-27 02:29:37
######## 10/27/2025, 2:29:47 AM
tid=f8bc5cb417b772d621749a23669f3429

 【请求的 ip 】：64.236.134.209
 【 用  户 】 加了  91         个单词上限2025-10-27 06:19:58
######## 10/27/2025, 6:20:09 AM
tid=f8bc5cb417b772d621749a23669f3429

 【请求的 ip 】：172.208.153.5
 【 用  户 】 加了  91         个单词上限2025-10-27 16:31:00
######## 10/27/2025, 4:31:10 PM
tid=f8bc5cb417b772d621749a23669f3429

 【请求的 ip 】：172.178.118.82
 【 用  户 】 加了  91         个单词上限2025-10-27 20:48:32
######## 10/27/2025, 8:48:42 PM
tid=f8bc5cb417b772d621749a23669f3429

 【请求的 ip 】：172.172.158.6
 【 用  户 】 加了  91         个单词上限2025-10-27 23:23:52
######## 10/27/2025, 11:24:02 PM
tid=f8bc5cb417b772d621749a23669f3429

 【请求的 ip 】：135.232.201.38
 【 用  户 】 加了  91         个单词上限2025-10-28 02:32:24
######## 10/28/2025, 2:32:35 AM
tid=f8bc5cb417b772d621749a23669f3429

 【请求的 ip 】：20.168.109.82
 【 用  户 】 加了  94         个单词上限2025-10-28 06:19:55
######## 10/28/2025, 6:20:05 AM
tid=f8bc5cb417b772d621749a23669f3429

 【请求的 ip 】：135.232.225.26
 【 用  户 】 加了  94         个单词上限2025-10-28 16:30:33
######## 10/28/2025, 4:30:44 PM
tid=f8bc5cb417b772d621749a23669f3429

 【请求的 ip 】：48.214.54.52
 【 用  户 】 加了  97         个单词上限2025-10-28 20:46:12
######## 10/28/2025, 8:46:22 PM
tid=f8bc5cb417b772d621749a23669f3429

 【请求的 ip 】：40.116.73.180
 【 用  户 】 加了  97         个单词上限2025-10-28 23:25:35
######## 10/28/2025, 11:25:45 PM
tid=f8bc5cb417b772d621749a23669f3429

 【请求的 ip 】：172.184.210.58
 【 用  户 】 加了  97         个单词上限2025-10-29 02:34:08
######## 10/29/2025, 2:34:18 AM
tid=f8bc5cb417b772d621749a23669f3429

 【请求的 ip 】：68.154.37.66
 【 用  户 】 加了  97         个单词上限2025-10-29 06:21:17
######## 10/29/2025, 6:21:27 AM
tid=f8bc5cb417b772d621749a23669f3429

 【请求的 ip 】：172.182.225.3
 【 用  户 】 加了  99         个单词上限2025-10-29 16:31:18
######## 10/29/2025, 4:31:28 PM
tid=f8bc5cb417b772d621749a23669f3429

 【请求的 ip 】：172.178.119.38
 【 用  户 】 加了  99         个单词上限2025-10-29 20:49:08
######## 10/29/2025, 8:49:18 PM
tid=f8bc5cb417b772d621749a23669f3429

 【请求的 ip 】：52.176.37.72
 【 用  户 】 加了  99         个单词上限2025-10-29 23:26:11
######## 10/29/2025, 11:26:22 PM
tid=f8bc5cb417b772d621749a23669f3429

 【请求的 ip 】：172.171.254.146
 【 用  户 】 加了  99         个单词上限2025-10-30 02:33:10
######## 10/30/2025, 2:33:20 AM
tid=f8bc5cb417b772d621749a23669f3429

 【请求的 ip 】：52.173.162.99
 【 用  户 】 加了  99         个单词上限2025-10-30 06:21:06
######## 10/30/2025, 6:21:16 AM
tid=f8bc5cb417b772d621749a23669f3429

 【请求的 ip 】：135.232.216.54
 【 用  户 】 加了  99         个单词上限2025-10-30 16:29:40
######## 10/30/2025, 4:29:50 PM
tid=f8bc5cb417b772d621749a23669f3429

 【请求的 ip 】：20.98.23.164
 【 用  户 】 加了  99         个单词上限2025-10-30 20:46:46
######## 10/30/2025, 8:46:56 PM
tid=f8bc5cb417b772d621749a23669f3429

 【请求的 ip 】：68.220.61.197
 【 用  户 】 加了  99         个单词上限2025-10-30 23:25:49
######## 10/30/2025, 11:25:59 PM
tid=f8bc5cb417b772d621749a23669f3429

 【请求的 ip 】：4.246.135.160
 【 用  户 】 加了  99         个单词上限2025-10-31 02:32:25
######## 10/31/2025, 2:32:35 AM
tid=f8bc5cb417b772d621749a23669f3429

 【请求的 ip 】：172.183.91.3
 【 用  户 】 加了  101         个单词上限2025-10-31 06:20:39
######## 10/31/2025, 6:20:49 AM
tid=f8bc5cb417b772d621749a23669f3429

 【请求的 ip 】：20.55.87.155
 【 用  户 】 加了  101         个单词上限2025-10-31 16:29:09
######## 10/31/2025, 4:29:19 PM
tid=f8bc5cb417b772d621749a23669f3429

 【请求的 ip 】：48.214.53.85
 【 用  户 】 加了  101         个单词上限2025-10-31 20:46:28
######## 10/31/2025, 8:46:38 PM
tid=f8bc5cb417b772d621749a23669f3429

 【请求的 ip 】：172.183.131.23
 【 用  户 】 加了  101         个单词上限2025-10-31 23:21:46
######## 10/31/2025, 11:21:57 PM
tid=f8bc5cb417b772d621749a23669f3429

 【请求的 ip 】：135.232.177.114
 【 用  户 】 加了  101         个单词上限2025-11-01 02:32:31
######## 11/1/2025, 2:32:41 AM
tid=f8bc5cb417b772d621749a23669f3429

 【请求的 ip 】：20.55.127.230
 【 用  户 】 加了  101         个单词上限2025-11-01 06:20:21
######## 11/1/2025, 6:20:31 AM
tid=f8bc5cb417b772d621749a23669f3429

 【请求的 ip 】：128.24.162.178
 【 用  户 】 加了  104         个单词上限2025-11-01 16:26:15
######## 11/1/2025, 4:26:25 PM
tid=f8bc5cb417b772d621749a23669f3429

 【请求的 ip 】：64.236.153.96
 【 用  户 】 加了  104         个单词上限2025-11-01 20:40:32
######## 11/1/2025, 8:40:42 PM
tid=f8bc5cb417b772d621749a23669f3429

 【请求的 ip 】：172.215.216.195
 【 用  户 】 加了  104         个单词上限2025-11-01 23:18:29
######## 11/1/2025, 11:18:39 PM
tid=f8bc5cb417b772d621749a23669f3429

 【请求的 ip 】：52.173.181.17
 【 用  户 】 加了  104         个单词上限2025-11-02 02:27:46
######## 11/2/2025, 2:27:55 AM
tid=f8bc5cb417b772d621749a23669f3429

 【请求的 ip 】：135.232.177.179
 【 用  户 】 加了  104         个单词上限2025-11-02 06:18:37
######## 11/2/2025, 6:18:48 AM
tid=f8bc5cb417b772d621749a23669f3429

 【请求的 ip 】：20.97.198.241
 【 用  户 】 加了  106         个单词上限2025-11-02 16:24:32
######## 11/2/2025, 4:24:42 PM
tid=f8bc5cb417b772d621749a23669f3429

 【请求的 ip 】：52.165.251.160
 【 用  户 】 加了  106         个单词上限2025-11-02 20:40:01
######## 11/2/2025, 8:40:11 PM
tid=f8bc5cb417b772d621749a23669f3429

 【请求的 ip 】：172.184.173.243
 【 用  户 】 加了  106         个单词上限2025-11-02 23:19:23
######## 11/2/2025, 11:19:33 PM
tid=f8bc5cb417b772d621749a23669f3429

 【请求的 ip 】：68.220.57.97
 【 用  户 】 加了  106         个单词上限2025-11-03 02:27:32
######## 11/3/2025, 2:27:42 AM
tid=f8bc5cb417b772d621749a23669f3429

 【请求的 ip 】：57.151.128.129
 【 用  户 】 加了  106         个单词上限2025-11-03 06:19:00
######## 11/3/2025, 6:19:10 AM
tid=f8bc5cb417b772d621749a23669f3429

 【请求的 ip 】：64.236.200.82
 【 用  户 】 加了  108         个单词上限2025-11-03 16:31:41
######## 11/3/2025, 4:31:51 PM
tid=f8bc5cb417b772d621749a23669f3429

 【请求的 ip 】：57.151.136.166
 【 用  户 】 加了  108         个单词上限2025-11-03 20:48:23
######## 11/3/2025, 8:48:33 PM
tid=f8bc5cb417b772d621749a23669f3429

 【请求的 ip 】：40.76.117.245
 【 用  户 】 加了  108         个单词上限2025-11-03 23:24:08
######## 11/3/2025, 11:24:18 PM
tid=f8bc5cb417b772d621749a23669f3429

 【请求的 ip 】：64.236.131.244
 【 用  户 】 加了  108         个单词上限2025-11-04 02:31:00
######## 11/4/2025, 2:31:11 AM
tid=f8bc5cb417b772d621749a23669f3429

 【请求的 ip 】：172.203.7.49
 【 用  户 】 加了  108         个单词上限2025-11-04 06:21:28
######## 11/4/2025, 6:21:38 AM
tid=f8bc5cb417b772d621749a23669f3429

 【请求的 ip 】：52.154.131.99
 【 用  户 】 加了  110         个单词上限2025-11-04 16:30:55
######## 11/4/2025, 4:31:06 PM
tid=f8bc5cb417b772d621749a23669f3429

 【请求的 ip 】：52.165.251.161
 【 用  户 】 加了  110         个单词上限2025-11-04 20:50:37
######## 11/4/2025, 8:50:47 PM
tid=f8bc5cb417b772d621749a23669f3429

 【请求的 ip 】：52.159.247.70
 【 用  户 】 加了  110         个单词上限2025-11-04 23:25:03
######## 11/4/2025, 11:25:14 PM
tid=f8bc5cb417b772d621749a23669f3429

 【请求的 ip 】：4.236.151.6
 【 用  户 】 加了  110         个单词上限2025-11-05 02:32:44
######## 11/5/2025, 2:32:54 AM
tid=f8bc5cb417b772d621749a23669f3429

 【请求的 ip 】：13.83.166.247
 【 用  户 】 加了  113         个单词上限2025-11-05 06:20:27
######## 11/5/2025, 6:20:38 AM
tid=f8bc5cb417b772d621749a23669f3429

 【请求的 ip 】：172.182.226.215
 【 用  户 】 加了  113         个单词上限2025-11-05 16:31:00
######## 11/5/2025, 4:31:10 PM
tid=f8bc5cb417b772d621749a23669f3429

 【请求的 ip 】：145.132.100.182
 【 用  户 】 加了  113         个单词上限2025-11-05 20:48:05
######## 11/5/2025, 8:48:15 PM
tid=f8bc5cb417b772d621749a23669f3429

 【请求的 ip 】：52.159.243.160
 【 用  户 】 加了  113         个单词上限2025-11-05 23:22:32
######## 11/5/2025, 11:22:42 PM
tid=f8bc5cb417b772d621749a23669f3429

 【请求的 ip 】：20.81.159.8
 【 用  户 】 加了  113         个单词上限2025-11-06 02:32:36
######## 11/6/2025, 2:32:46 AM
tid=f8bc5cb417b772d621749a23669f3429

 【请求的 ip 】：172.184.172.214
 【 用  户 】 加了  113         个单词上限2025-11-06 06:21:15
######## 11/6/2025, 6:21:25 AM
tid=f8bc5cb417b772d621749a23669f3429

 【请求的 ip 】：135.232.232.21
 【 用  户 】 加了  113         个单词上限2025-11-06 16:30:37
######## 11/6/2025, 4:30:47 PM
tid=f8bc5cb417b772d621749a23669f3429

 【请求的 ip 】：20.81.159.35
 【 用  户 】 加了  113         个单词上限2025-11-06 20:47:18
######## 11/6/2025, 8:47:29 PM
tid=f8bc5cb417b772d621749a23669f3429

 【请求的 ip 】：20.109.92.210
 【 用  户 】 加了  113         个单词上限2025-11-06 23:25:22
######## 11/6/2025, 11:25:32 PM
tid=f8bc5cb417b772d621749a23669f3429

 【请求的 ip 】：68.220.61.2
 【 用  户 】 加了  113         个单词上限2025-11-07 02:33:48
######## 11/7/2025, 2:33:58 AM
tid=f8bc5cb417b772d621749a23669f3429

 【请求的 ip 】：132.196.32.73
 【 用  户 】 加了  113         个单词上限2025-11-07 06:21:21
######## 11/7/2025, 6:21:31 AM
tid=f8bc5cb417b772d621749a23669f3429

 【请求的 ip 】：4.236.173.21
 【 用  户 】 加了  115         个单词上限2025-11-07 16:30:28
######## 11/7/2025, 4:30:37 PM
tid=f8bc5cb417b772d621749a23669f3429

 【请求的 ip 】：172.184.213.161
 【 用  户 】 加了  115         个单词上限2025-11-07 20:45:45
######## 11/7/2025, 8:45:56 PM
tid=f8bc5cb417b772d621749a23669f3429

 【请求的 ip 】：172.214.44.55
 【 用  户 】 加了  115         个单词上限2025-11-07 23:23:16
######## 11/7/2025, 11:23:26 PM
tid=f8bc5cb417b772d621749a23669f3429

 【请求的 ip 】：20.98.18.65
 【 用  户 】 加了  115         个单词上限2025-11-08 02:31:28
######## 11/8/2025, 2:31:38 AM
tid=f8bc5cb417b772d621749a23669f3429

 【请求的 ip 】：172.184.210.36
 【 用  户 】 加了  118         个单词上限2025-11-08 06:20:42
######## 11/8/2025, 6:20:51 AM
tid=f8bc5cb417b772d621749a23669f3429

 【请求的 ip 】：52.176.125.115
 【 用  户 】 加了  118         个单词上限2025-11-08 16:26:51
######## 11/8/2025, 4:27:01 PM
tid=f8bc5cb417b772d621749a23669f3429

 【请求的 ip 】：68.220.61.177
 【 用  户 】 加了  118         个单词上限2025-11-08 20:40:54
######## 11/8/2025, 8:41:05 PM
tid=f8bc5cb417b772d621749a23669f3429

 【请求的 ip 】：64.236.133.129
 【 用  户 】 加了  118         个单词上限2025-11-08 23:19:27
######## 11/8/2025, 11:19:37 PM
tid=f8bc5cb417b772d621749a23669f3429

 【请求的 ip 】：172.182.211.20
 【 用  户 】 加了  118         个单词上限2025-11-09 02:29:04
######## 11/9/2025, 2:29:14 AM
tid=f8bc5cb417b772d621749a23669f3429

 【请求的 ip 】：20.161.68.241
 【 用  户 】 加了  118         个单词上限2025-11-09 06:18:47
######## 11/9/2025, 6:18:56 AM
tid=f8bc5cb417b772d621749a23669f3429

 【请求的 ip 】：52.159.246.3
 【 用  户 】 加了  118         个单词上限2025-11-09 16:25:25
######## 11/9/2025, 4:25:36 PM
tid=f8bc5cb417b772d621749a23669f3429

 【请求的 ip 】：20.161.78.66
 【 用  户 】 加了  118         个单词上限2025-11-09 20:40:44
######## 11/9/2025, 8:40:55 PM
tid=f8bc5cb417b772d621749a23669f3429

 【请求的 ip 】：135.232.200.33
 【 用  户 】 加了  118         个单词上限2025-11-09 23:19:04
######## 11/9/2025, 11:19:14 PM
tid=f8bc5cb417b772d621749a23669f3429

 【请求的 ip 】：145.132.99.99
 【 用  户 】 加了  118         个单词上限2025-11-10 02:28:23
######## 11/10/2025, 2:28:33 AM
tid=f8bc5cb417b772d621749a23669f3429

 【请求的 ip 】：20.169.75.145
 【 用  户 】 加了  120         个单词上限2025-11-10 06:19:27
######## 11/10/2025, 6:19:38 AM
tid=f8bc5cb417b772d621749a23669f3429

 【请求的 ip 】：68.220.61.192
 【 用  户 】 加了  120         个单词上限2025-11-10 16:31:44
######## 11/10/2025, 4:31:54 PM
tid=f8bc5cb417b772d621749a23669f3429

 【请求的 ip 】：52.161.82.81
 【 用  户 】 加了  120         个单词上限2025-11-10 20:48:47
######## 11/10/2025, 8:48:57 PM
tid=f8bc5cb417b772d621749a23669f3429

 【请求的 ip 】：172.172.87.71
 【 用  户 】 加了  120         个单词上限2025-11-10 23:25:26
######## 11/10/2025, 11:25:41 PM
tid=f8bc5cb417b772d621749a23669f3429

 【请求的 ip 】：172.215.216.215
 【 用  户 】 加了  120         个单词上限2025-11-11 02:32:28
######## 11/11/2025, 2:32:38 AM
tid=f8bc5cb417b772d621749a23669f3429

 【请求的 ip 】：135.119.132.149
 【 用  户 】 加了  120         个单词上限2025-11-11 06:22:06
######## 11/11/2025, 6:22:15 AM
tid=f8bc5cb417b772d621749a23669f3429

 【请求的 ip 】：20.171.123.129
 【 用  户 】 加了  121         个单词上限2025-11-11 16:29:58
######## 11/11/2025, 4:30:18 PM
tid=f8bc5cb417b772d621749a23669f3429

 【请求的 ip 】：172.184.175.145
 【 用  户 】 加了  121         个单词上限2025-11-11 20:47:16
######## 11/11/2025, 8:47:27 PM
tid=f8bc5cb417b772d621749a23669f3429

 【请求的 ip 】：48.211.211.34
 【 用  户 】 加了  121         个单词上限2025-11-11 23:25:02
######## 11/11/2025, 11:25:12 PM
tid=f8bc5cb417b772d621749a23669f3429

 【请求的 ip 】：52.161.51.148
 【 用  户 】 加了  121         个单词上限2025-11-12 02:32:04
######## 11/12/2025, 2:32:14 AM
tid=f8bc5cb417b772d621749a23669f3429

 【请求的 ip 】：52.161.75.168
 【 用  户 】 加了  121         个单词上限2025-11-12 06:21:27
######## 11/12/2025, 6:21:38 AM
tid=f8bc5cb417b772d621749a23669f3429

 【请求的 ip 】：145.132.102.51
 【 用  户 】 加了  121         个单词上限2025-11-12 16:31:39
######## 11/12/2025, 4:31:49 PM
tid=f8bc5cb417b772d621749a23669f3429

 【请求的 ip 】：172.172.157.1
 【 用  户 】 加了  121         个单词上限2025-11-12 20:49:17
######## 11/12/2025, 8:49:27 PM
tid=f8bc5cb417b772d621749a23669f3429

 【请求的 ip 】：68.220.58.149
 【 用  户 】 加了  121         个单词上限2025-11-12 23:26:38
######## 11/12/2025, 11:26:49 PM
tid=f8bc5cb417b772d621749a23669f3429

 【请求的 ip 】：135.232.224.83
 【 用  户 】 加了  121         个单词上限2025-11-13 02:31:29
######## 11/13/2025, 2:31:39 AM
tid=f8bc5cb417b772d621749a23669f3429

 【请求的 ip 】：52.159.245.164
 【 用  户 】 加了  121         个单词上限2025-11-13 06:21:40
######## 11/13/2025, 6:21:49 AM
tid=f8bc5cb417b772d621749a23669f3429

 【请求的 ip 】：52.238.26.241
 【 用  户 】 加了  121         个单词上限2025-11-13 16:31:07
######## 11/13/2025, 4:31:17 PM
tid=f8bc5cb417b772d621749a23669f3429

 【请求的 ip 】：172.182.226.224
 【 用  户 】 加了  121         个单词上限2025-11-13 20:50:01
######## 11/13/2025, 8:50:11 PM
tid=f8bc5cb417b772d621749a23669f3429

 【请求的 ip 】：172.182.211.23
 【 用  户 】 加了  121         个单词上限2025-11-13 23:25:24
######## 11/13/2025, 11:25:34 PM
tid=f8bc5cb417b772d621749a23669f3429

 【请求的 ip 】：145.132.102.50
 【 用  户 】 加了  121         个单词上限2025-11-14 02:32:25
######## 11/14/2025, 2:32:36 AM
tid=f8bc5cb417b772d621749a23669f3429

 【请求的 ip 】：64.236.141.200
 【 用  户 】 加了  124         个单词上限2025-11-14 06:21:45
######## 11/14/2025, 6:21:57 AM
tid=f8bc5cb417b772d621749a23669f3429

 【请求的 ip 】：40.79.247.68
 【 用  户 】 加了  124         个单词上限2025-11-14 16:29:55
######## 11/14/2025, 4:30:05 PM
tid=f8bc5cb417b772d621749a23669f3429

 【请求的 ip 】：135.119.38.35
 【 用  户 】 加了  124         个单词上限2025-11-14 20:46:31
######## 11/14/2025, 8:46:41 PM
tid=f8bc5cb417b772d621749a23669f3429

 【请求的 ip 】：52.238.26.240
 【 用  户 】 加了  124         个单词上限2025-11-14 23:20:32
######## 11/14/2025, 11:20:42 PM
tid=f8bc5cb417b772d621749a23669f3429

 【请求的 ip 】：20.55.223.177
 【 用  户 】 加了  124         个单词上限2025-11-15 02:32:08
######## 11/15/2025, 2:32:18 AM
tid=f8bc5cb417b772d621749a23669f3429

 【请求的 ip 】：64.236.161.21
 【 用  户 】 加了  126         个单词上限2025-11-15 06:21:28
######## 11/15/2025, 6:21:38 AM
tid=f8bc5cb417b772d621749a23669f3429

 【请求的 ip 】：52.159.245.147
 【 用  户 】 加了  126         个单词上限2025-11-15 16:26:30
######## 11/15/2025, 4:26:40 PM
tid=f8bc5cb417b772d621749a23669f3429

 【请求的 ip 】：57.151.129.36
 【 用  户 】 加了  126         个单词上限2025-11-15 20:41:01
######## 11/15/2025, 8:41:11 PM
tid=f8bc5cb417b772d621749a23669f3429

 【请求的 ip 】：20.236.100.2
 【 用  户 】 加了  126         个单词上限2025-11-15 23:20:15
######## 11/15/2025, 11:20:25 PM
tid=f8bc5cb417b772d621749a23669f3429

 【请求的 ip 】：172.183.89.130
 【 用  户 】 加了  126         个单词上限2025-11-16 02:28:37
######## 11/16/2025, 2:28:48 AM
tid=f8bc5cb417b772d621749a23669f3429

 【请求的 ip 】：135.232.208.130
 【 用  户 】 加了  126         个单词上限2025-11-16 06:17:19
######## 11/16/2025, 6:17:29 AM
tid=f8bc5cb417b772d621749a23669f3429

 【请求的 ip 】：68.154.118.241
 【 用  户 】 加了  128         个单词上限2025-11-16 16:27:25
######## 11/16/2025, 4:27:35 PM
tid=f8bc5cb417b772d621749a23669f3429

 【请求的 ip 】：172.172.153.35
 【 用  户 】 加了  128         个单词上限2025-11-16 20:40:44
######## 11/16/2025, 8:40:54 PM
tid=f8bc5cb417b772d621749a23669f3429

 【请求的 ip 】：172.182.226.19
 【 用  户 】 加了  128         个单词上限2025-11-16 23:20:00
######## 11/16/2025, 11:20:11 PM
tid=f8bc5cb417b772d621749a23669f3429

 【请求的 ip 】：4.246.135.163
 【 用  户 】 加了  128         个单词上限2025-11-17 02:29:20
######## 11/17/2025, 2:29:30 AM
tid=f8bc5cb417b772d621749a23669f3429

 【请求的 ip 】：172.215.216.209
 【 用  户 】 加了  128         个单词上限2025-11-17 06:20:07
######## 11/17/2025, 6:20:17 AM
tid=f8bc5cb417b772d621749a23669f3429

 【请求的 ip 】：20.169.74.96
 【 用  户 】 加了  130         个单词上限2025-11-17 16:32:44
######## 11/17/2025, 4:32:54 PM
tid=f8bc5cb417b772d621749a23669f3429

 【请求的 ip 】：20.109.38.165
 【 用  户 】 加了  130         个单词上限2025-11-17 20:48:23
######## 11/17/2025, 8:48:33 PM
tid=f8bc5cb417b772d621749a23669f3429

 【请求的 ip 】：20.236.100.0
 【 用  户 】 加了  130         个单词上限2025-11-17 23:25:57
######## 11/17/2025, 11:26:07 PM
tid=f8bc5cb417b772d621749a23669f3429

 【请求的 ip 】：52.159.244.181
 【 用  户 】 加了  130         个单词上限2025-11-18 02:32:30
######## 11/18/2025, 2:32:40 AM
tid=f8bc5cb417b772d621749a23669f3429

 【请求的 ip 】：57.151.129.51
 【 用  户 】 加了  130         个单词上限2025-11-18 06:21:24
######## 11/18/2025, 6:21:34 AM
tid=f8bc5cb417b772d621749a23669f3429

 【请求的 ip 】：64.236.201.59
 【 用  户 】 加了  133         个单词上限2025-11-18 16:30:48
######## 11/18/2025, 4:30:58 PM
tid=f8bc5cb417b772d621749a23669f3429

 【请求的 ip 】：68.220.63.1
 【 用  户 】 加了  133         个单词上限2025-11-18 20:48:30
######## 11/18/2025, 8:48:43 PM
tid=f8bc5cb417b772d621749a23669f3429

 【 用  户 】 加了  133         个单词上限2025-11-18 23:26:25
######## 11/18/2025, 11:26:36 PM
tid=f8bc5cb417b772d621749a23669f3429

 【请求的 ip 】：145.132.102.228
 【 用  户 】 加了  133         个单词上限2025-11-19 02:34:02
######## 11/19/2025, 2:34:12 AM
tid=f8bc5cb417b772d621749a23669f3429

 【请求的 ip 】：52.159.243.20
 【 用  户 】 加了  133         个单词上限2025-11-19 06:22:33
######## 11/19/2025, 6:22:43 AM
tid=f8bc5cb417b772d621749a23669f3429

 【请求的 ip 】：52.173.163.132
 【 用  户 】 加了  135         个单词上限2025-11-19 16:30:40
######## 11/19/2025, 4:30:50 PM
tid=f8bc5cb417b772d621749a23669f3429

 【请求的 ip 】：132.196.82.2
 【 用  户 】 加了  135         个单词上限2025-11-19 20:49:01
######## 11/19/2025, 8:49:12 PM
tid=f8bc5cb417b772d621749a23669f3429

 【请求的 ip 】：64.236.169.135
 【 用  户 】 加了  135         个单词上限2025-11-19 23:24:41
######## 11/19/2025, 11:24:51 PM
tid=f8bc5cb417b772d621749a23669f3429

 【请求的 ip 】：52.159.247.151
 【 用  户 】 加了  135         个单词上限2025-11-20 02:34:00
######## 11/20/2025, 2:34:10 AM
tid=f8bc5cb417b772d621749a23669f3429

 【请求的 ip 】：20.161.30.48
 【 用  户 】 加了  135         个单词上限2025-11-20 06:21:39
######## 11/20/2025, 6:21:49 AM
tid=f8bc5cb417b772d621749a23669f3429

 【请求的 ip 】：172.208.127.196
 【 用  户 】 加了  135         个单词上限2025-11-20 16:31:44
######## 11/20/2025, 4:31:54 PM
tid=f8bc5cb417b772d621749a23669f3429

 【请求的 ip 】：172.215.216.224
 【 用  户 】 加了  135         个单词上限2025-11-20 20:46:57
######## 11/20/2025, 8:47:07 PM
tid=f8bc5cb417b772d621749a23669f3429

 【请求的 ip 】：135.232.216.70
 【 用  户 】 加了  135         个单词上限2025-11-20 23:25:02
######## 11/20/2025, 11:25:12 PM
tid=f8bc5cb417b772d621749a23669f3429

 【请求的 ip 】：57.151.130.4
 【 用  户 】 加了  135         个单词上限2025-11-21 02:33:39
######## 11/21/2025, 2:33:49 AM
tid=f8bc5cb417b772d621749a23669f3429

 【请求的 ip 】：52.159.247.68
 【 用  户 】 加了  137         个单词上限2025-11-21 06:20:02
######## 11/21/2025, 6:20:12 AM
tid=f8bc5cb417b772d621749a23669f3429

 【请求的 ip 】：52.165.58.37
 【 用  户 】 加了  137         个单词上限2025-11-21 16:32:08
######## 11/21/2025, 4:32:18 PM
tid=f8bc5cb417b772d621749a23669f3429

 【请求的 ip 】：52.159.244.82
 【 用  户 】 加了  137         个单词上限2025-11-21 20:45:26
######## 11/21/2025, 8:45:36 PM
tid=f8bc5cb417b772d621749a23669f3429

 【请求的 ip 】：172.212.167.81
 【 用  户 】 加了  137         个单词上限2025-11-21 23:20:40
######## 11/21/2025, 11:20:51 PM
tid=f8bc5cb417b772d621749a23669f3429

 【请求的 ip 】：135.119.236.54
 【 用  户 】 加了  137         个单词上限2025-11-22 02:29:38
######## 11/22/2025, 2:29:48 AM
tid=f8bc5cb417b772d621749a23669f3429

 【请求的 ip 】：172.182.196.52
 【 用  户 】 加了  140         个单词上限2025-11-22 06:22:08
######## 11/22/2025, 6:22:18 AM
tid=f8bc5cb417b772d621749a23669f3429

 【请求的 ip 】：172.174.165.2
 【 用  户 】 加了  140         个单词上限2025-11-22 16:27:41
######## 11/22/2025, 4:27:51 PM
tid=f8bc5cb417b772d621749a23669f3429

 【请求的 ip 】：172.184.210.33
 【 用  户 】 加了  140         个单词上限2025-11-22 20:40:06
######## 11/22/2025, 8:40:16 PM
tid=f8bc5cb417b772d621749a23669f3429

 【请求的 ip 】：20.98.18.64
 【 用  户 】 加了  140         个单词上限2025-11-22 23:19:56
######## 11/22/2025, 11:20:06 PM
tid=f8bc5cb417b772d621749a23669f3429

 【请求的 ip 】：64.236.140.163
 【 用  户 】 加了  140         个单词上限2025-11-23 02:29:55
######## 11/23/2025, 2:30:05 AM
tid=f8bc5cb417b772d621749a23669f3429

 【请求的 ip 】：40.76.191.129
 【 用  户 】 加了  140         个单词上限2025-11-23 06:20:37
######## 11/23/2025, 6:20:47 AM
tid=f8bc5cb417b772d621749a23669f3429

 【请求的 ip 】：145.132.99.130
 【 用  户 】 加了  140         个单词上限2025-11-23 16:28:02
######## 11/23/2025, 4:28:12 PM
tid=f8bc5cb417b772d621749a23669f3429

 【请求的 ip 】：172.184.210.35
 【 用  户 】 加了  140         个单词上限2025-11-23 20:39:35
######## 11/23/2025, 8:39:45 PM
tid=f8bc5cb417b772d621749a23669f3429

 【请求的 ip 】：52.159.247.193
 【 用  户 】 加了  140         个单词上限2025-11-23 23:20:16
######## 11/23/2025, 11:20:26 PM
tid=f8bc5cb417b772d621749a23669f3429

 【请求的 ip 】：172.177.209.209
 【 用  户 】 加了  140         个单词上限2025-11-24 02:30:20
######## 11/24/2025, 2:30:30 AM
tid=f8bc5cb417b772d621749a23669f3429

 【请求的 ip 】：64.236.143.210
 【 用  户 】 加了  140         个单词上限2025-11-24 06:20:44
######## 11/24/2025, 6:20:55 AM
tid=f8bc5cb417b772d621749a23669f3429

 【请求的 ip 】：172.172.87.70
 【 用  户 】 加了  140         个单词上限2025-11-24 16:33:24
######## 11/24/2025, 4:33:34 PM
tid=f8bc5cb417b772d621749a23669f3429

 【请求的 ip 】：52.165.251.245
 【 用  户 】 加了  140         个单词上限2025-11-24 20:49:47
######## 11/24/2025, 8:49:58 PM
tid=f8bc5cb417b772d621749a23669f3429

 【请求的 ip 】：172.172.87.49
 【 用  户 】 加了  142         个单词上限2025-11-24 23:27:00
######## 11/24/2025, 11:27:10 PM
tid=f8bc5cb417b772d621749a23669f3429

 【请求的 ip 】：172.184.211.162
 【 用  户 】 加了  142         个单词上限2025-11-25 02:34:34
######## 11/25/2025, 2:34:44 AM
tid=f8bc5cb417b772d621749a23669f3429

 【请求的 ip 】：172.182.212.49
 【 用  户 】 加了  142         个单词上限2025-11-25 06:21:34
######## 11/25/2025, 6:21:44 AM
tid=f8bc5cb417b772d621749a23669f3429

 【请求的 ip 】：52.176.19.197
 【 用  户 】 加了  142         个单词上限2025-11-25 16:32:06
######## 11/25/2025, 4:32:17 PM
tid=f8bc5cb417b772d621749a23669f3429

 【请求的 ip 】：135.232.208.120
 【 用  户 】 加了  142         个单词上限2025-11-25 20:49:17
######## 11/25/2025, 8:49:27 PM
tid=f8bc5cb417b772d621749a23669f3429

 【请求的 ip 】：68.220.56.243
 【 用  户 】 加了  142         个单词上限2025-11-25 23:26:02
######## 11/25/2025, 11:26:12 PM
tid=f8bc5cb417b772d621749a23669f3429

 【请求的 ip 】：64.236.161.38
 【 用  户 】 加了  142         个单词上限2025-11-26 02:35:07
######## 11/26/2025, 2:35:18 AM
tid=f8bc5cb417b772d621749a23669f3429

 【请求的 ip 】：64.236.169.98
 【 用  户 】 加了  144         个单词上限2025-11-26 06:22:50
######## 11/26/2025, 6:23:01 AM
tid=f8bc5cb417b772d621749a23669f3429

 【请求的 ip 】：64.236.177.104
 【 用  户 】 加了  144         个单词上限2025-11-26 16:31:37
######## 11/26/2025, 4:31:47 PM
tid=f8bc5cb417b772d621749a23669f3429

 【请求的 ip 】：172.214.47.32
 【 用  户 】 加了  144         个单词上限2025-11-26 20:50:29
######## 11/26/2025, 8:50:39 PM
tid=f8bc5cb417b772d621749a23669f3429

 【请求的 ip 】：40.79.245.16
 【 用  户 】 加了  144         个单词上限2025-11-26 23:22:45
######## 11/26/2025, 11:22:56 PM
tid=f8bc5cb417b772d621749a23669f3429

 【请求的 ip 】：68.154.54.37
 【 用  户 】 加了  144         个单词上限2025-11-27 02:29:56
######## 11/27/2025, 2:30:06 AM
tid=f8bc5cb417b772d621749a23669f3429

 【请求的 ip 】：40.76.117.247
 【 用  户 】 加了  145         个单词上限2025-11-27 06:22:00
######## 11/27/2025, 6:22:11 AM
tid=f8bc5cb417b772d621749a23669f3429

 【请求的 ip 】：172.174.167.16
 【 用  户 】 加了  145         个单词上限2025-11-27 16:32:18
######## 11/27/2025, 4:32:28 PM
tid=f8bc5cb417b772d621749a23669f3429

 【请求的 ip 】：172.215.217.241
 【 用  户 】 加了  145         个单词上限2025-11-27 20:49:16
######## 11/27/2025, 8:49:27 PM
tid=f8bc5cb417b772d621749a23669f3429

 【请求的 ip 】：135.232.200.18
 【 用  户 】 加了  145         个单词上限2025-11-27 23:24:02
######## 11/27/2025, 11:24:12 PM
tid=f8bc5cb417b772d621749a23669f3429

 【请求的 ip 】：20.169.50.41
 【 用  户 】 加了  145         个单词上限2025-11-28 02:31:41
######## 11/28/2025, 2:31:51 AM
tid=f8bc5cb417b772d621749a23669f3429

 【请求的 ip 】：74.249.78.165
 【 用  户 】 加了  145         个单词上限2025-11-28 06:21:26
######## 11/28/2025, 6:21:36 AM
tid=f8bc5cb417b772d621749a23669f3429

 【请求的 ip 】：20.109.38.50
 【 用  户 】 加了  147         个单词上限2025-11-28 16:31:48
######## 11/28/2025, 4:31:59 PM
tid=f8bc5cb417b772d621749a23669f3429

 【请求的 ip 】：135.119.235.83
 【 用  户 】 加了  147         个单词上限2025-11-28 20:47:20
######## 11/28/2025, 8:47:31 PM
tid=f8bc5cb417b772d621749a23669f3429

 【请求的 ip 】：135.232.232.18
 【 用  户 】 加了  149         个单词上限2025-11-28 23:23:50
######## 11/28/2025, 11:24:01 PM
tid=f8bc5cb417b772d621749a23669f3429

 【请求的 ip 】：57.151.137.181
 【 用  户 】 加了  149         个单词上限2025-11-29 02:31:53
######## 11/29/2025, 2:32:03 AM
tid=f8bc5cb417b772d621749a23669f3429

 【请求的 ip 】：172.172.87.67
 【 用  户 】 加了  149         个单词上限2025-11-29 06:20:58
######## 11/29/2025, 6:21:08 AM
tid=f8bc5cb417b772d621749a23669f3429

 【请求的 ip 】：68.154.115.176
 【 用  户 】 加了  149         个单词上限2025-11-29 16:28:44
######## 11/29/2025, 4:28:55 PM
tid=f8bc5cb417b772d621749a23669f3429

 【请求的 ip 】：20.161.44.176
 【 用  户 】 加了  149         个单词上限2025-11-29 20:42:52
######## 11/29/2025, 8:43:02 PM
tid=f8bc5cb417b772d621749a23669f3429

 【请求的 ip 】：172.184.191.163
 【 用  户 】 加了  149         个单词上限2025-11-29 23:20:51
######## 11/29/2025, 11:21:01 PM
tid=f8bc5cb417b772d621749a23669f3429

 【请求的 ip 】：172.183.131.66
 【 用  户 】 加了  149         个单词上限2025-11-30 02:30:46
######## 11/30/2025, 2:30:57 AM
tid=f8bc5cb417b772d621749a23669f3429

 【请求的 ip 】：52.159.229.146
 【 用  户 】 加了  149         个单词上限2025-11-30 06:20:48
######## 11/30/2025, 6:20:59 AM
tid=f8bc5cb417b772d621749a23669f3429

 【请求的 ip 】：145.132.99.129
 【 用  户 】 加了  149         个单词上限2025-11-30 16:27:13
######## 11/30/2025, 4:27:23 PM
tid=f8bc5cb417b772d621749a23669f3429

 【请求的 ip 】：68.154.54.34
 【 用  户 】 加了  149         个单词上限2025-11-30 20:42:20
######## 11/30/2025, 8:42:30 PM
tid=f8bc5cb417b772d621749a23669f3429

 【请求的 ip 】：64.236.201.17
 【 用  户 】 加了  149         个单词上限2025-11-30 23:20:29
######## 11/30/2025, 11:20:39 PM
tid=f8bc5cb417b772d621749a23669f3429

 【请求的 ip 】：135.119.235.85
 【 用  户 】 加了  149         个单词上限2025-12-01 02:30:50
######## 12/1/2025, 2:31:01 AM
tid=f8bc5cb417b772d621749a23669f3429

 【请求的 ip 】：20.169.72.10
 【 用  户 】 加了  149         个单词上限2025-12-01 06:21:21
######## 12/1/2025, 6:21:32 AM
tid=f8bc5cb417b772d621749a23669f3429

 【请求的 ip 】：172.200.23.65
 【 用  户 】 加了  149         个单词上限2025-12-01 16:35:33
######## 12/1/2025, 4:35:43 PM
tid=f8bc5cb417b772d621749a23669f3429

 【请求的 ip 】：104.209.11.211
 【 用  户 】 加了  149         个单词上限2025-12-01 20:50:45
######## 12/1/2025, 8:50:56 PM
tid=f8bc5cb417b772d621749a23669f3429

 【请求的 ip 】：4.246.134.176
 【 用  户 】 加了  149         个单词上限2025-12-01 23:27:18
######## 12/1/2025, 11:27:28 PM
tid=f8bc5cb417b772d621749a23669f3429

 【请求的 ip 】：172.182.213.69
 【 用  户 】 加了  149         个单词上限2025-12-02 02:38:02
######## 12/2/2025, 2:38:12 AM
tid=f8bc5cb417b772d621749a23669f3429

 【请求的 ip 】：20.109.95.100
 【 用  户 】 加了  149         个单词上限2025-12-02 06:21:04
######## 12/2/2025, 6:21:14 AM
tid=f8bc5cb417b772d621749a23669f3429

 【请求的 ip 】：20.161.45.118
 【 用  户 】 加了  149         个单词上限2025-12-02 16:34:06
######## 12/2/2025, 4:34:17 PM
tid=f8bc5cb417b772d621749a23669f3429

 【请求的 ip 】：172.183.132.65
 【 用  户 】 加了  149         个单词上限2025-12-02 20:51:17
######## 12/2/2025, 8:51:26 PM
tid=f8bc5cb417b772d621749a23669f3429

 【请求的 ip 】：104.209.7.227
 【 用  户 】 加了  149         个单词上限2025-12-02 23:27:04
######## 12/2/2025, 11:27:15 PM
tid=f8bc5cb417b772d621749a23669f3429

 【请求的 ip 】：64.236.160.192
 【 用  户 】 加了  149         个单词上限2025-12-03 02:37:16
######## 12/3/2025, 2:37:26 AM
tid=f8bc5cb417b772d621749a23669f3429

 【请求的 ip 】：68.220.62.144
 【 用  户 】 加了  152         个单词上限2025-12-03 06:19:56
######## 12/3/2025, 6:20:07 AM
tid=f8bc5cb417b772d621749a23669f3429

 【请求的 ip 】：135.232.200.208
 【 用  户 】 加了  152         个单词上限2025-12-03 16:33:07
######## 12/3/2025, 4:33:17 PM
tid=f8bc5cb417b772d621749a23669f3429

 【请求的 ip 】：172.200.23.64
 【 用  户 】 加了  152         个单词上限2025-12-03 20:51:34
######## 12/3/2025, 8:51:44 PM
tid=f8bc5cb417b772d621749a23669f3429

 【请求的 ip 】：135.232.224.164
 【 用  户 】 加了  152         个单词上限2025-12-03 23:27:20
######## 12/3/2025, 11:27:29 PM
tid=f8bc5cb417b772d621749a23669f3429

 【请求的 ip 】：172.184.210.241
 【 用  户 】 加了  152         个单词上限2025-12-04 02:36:37
######## 12/4/2025, 2:36:47 AM
tid=f8bc5cb417b772d621749a23669f3429

 【请求的 ip 】：68.154.116.114
 【 用  户 】 加了  154         个单词上限2025-12-04 06:23:11
######## 12/4/2025, 6:23:22 AM
tid=f8bc5cb417b772d621749a23669f3429

 【请求的 ip 】：128.24.160.170
 【 用  户 】 加了  154         个单词上限2025-12-04 16:33:29
######## 12/4/2025, 4:33:39 PM
tid=f8bc5cb417b772d621749a23669f3429

 【请求的 ip 】：172.182.213.150
 【 用  户 】 加了  154         个单词上限2025-12-04 20:51:56
######## 12/4/2025, 8:52:07 PM
tid=f8bc5cb417b772d621749a23669f3429

 【请求的 ip 】：172.178.118.86
 【 用  户 】 加了  154         个单词上限2025-12-04 23:28:05
######## 12/4/2025, 11:28:15 PM
tid=f8bc5cb417b772d621749a23669f3429

 【请求的 ip 】：135.232.225.21
 【 用  户 】 加了  154         个单词上限2025-12-05 02:37:13
######## 12/5/2025, 2:37:23 AM
tid=f8bc5cb417b772d621749a23669f3429

 【请求的 ip 】：64.236.135.0
 【 用  户 】 加了  154         个单词上限2025-12-05 06:20:44
######## 12/5/2025, 6:20:54 AM
tid=f8bc5cb417b772d621749a23669f3429

 【请求的 ip 】：52.154.130.210
 【 用  户 】 加了  155         个单词上限2025-12-05 16:32:01
######## 12/5/2025, 4:32:12 PM
tid=f8bc5cb417b772d621749a23669f3429

 【请求的 ip 】：68.220.56.245
 【 用  户 】 加了  155         个单词上限2025-12-05 20:49:07
######## 12/5/2025, 8:49:17 PM
tid=f8bc5cb417b772d621749a23669f3429

 【请求的 ip 】：68.154.119.213
 【 用  户 】 加了  155         个单词上限2025-12-05 23:25:34
######## 12/5/2025, 11:25:44 PM
tid=f8bc5cb417b772d621749a23669f3429

 【请求的 ip 】：52.159.229.48
 【 用  户 】 加了  155         个单词上限2025-12-06 02:31:48
######## 12/6/2025, 2:31:58 AM
tid=f8bc5cb417b772d621749a23669f3429

 【请求的 ip 】：172.183.131.69
 【 用  户 】 加了  158         个单词上限2025-12-06 06:22:12
######## 12/6/2025, 6:22:22 AM
tid=f8bc5cb417b772d621749a23669f3429

 【请求的 ip 】：57.151.128.215
 【 用  户 】 加了  158         个单词上限2025-12-06 16:28:34
######## 12/6/2025, 4:28:44 PM
tid=f8bc5cb417b772d621749a23669f3429

 【请求的 ip 】：20.62.207.241
 【 用  户 】 加了  158         个单词上限2025-12-06 20:43:01
######## 12/6/2025, 8:43:11 PM
tid=f8bc5cb417b772d621749a23669f3429

 【请求的 ip 】：52.154.21.48
 【 用  户 】 加了  158         个单词上限2025-12-06 23:20:50
######## 12/6/2025, 11:21:00 PM
tid=f8bc5cb417b772d621749a23669f3429

 【请求的 ip 】：4.246.134.179
 【 用  户 】 加了  158         个单词上限2025-12-07 02:30:22
######## 12/7/2025, 2:30:32 AM
tid=f8bc5cb417b772d621749a23669f3429

 【请求的 ip 】：135.232.200.67
 【 用  户 】 加了  158         个单词上限2025-12-07 06:21:17
######## 12/7/2025, 6:21:27 AM
tid=f8bc5cb417b772d621749a23669f3429

 【请求的 ip 】：172.184.174.113
 【 用  户 】 加了  159         个单词上限2025-12-07 16:27:59
######## 12/7/2025, 4:28:10 PM
tid=f8bc5cb417b772d621749a23669f3429

 【请求的 ip 】：145.132.102.103
 【 用  户 】 加了  159         个单词上限2025-12-07 20:41:59
######## 12/7/2025, 8:42:09 PM
tid=f8bc5cb417b772d621749a23669f3429

 【请求的 ip 】：48.214.55.34
 【 用  户 】 加了  159         个单词上限2025-12-07 23:20:24
######## 12/7/2025, 11:20:34 PM
tid=f8bc5cb417b772d621749a23669f3429

 【请求的 ip 】：172.212.171.147
 【 用  户 】 加了  159         个单词上限2025-12-08 02:30:31
######## 12/8/2025, 2:30:42 AM
tid=f8bc5cb417b772d621749a23669f3429

 【请求的 ip 】：145.132.100.176
 【 用  户 】 加了  161         个单词上限2025-12-08 06:20:44
######## 12/8/2025, 6:20:54 AM
tid=f8bc5cb417b772d621749a23669f3429

 【请求的 ip 】：20.161.69.35
 【 用  户 】 加了  161         个单词上限2025-12-08 16:35:19
######## 12/8/2025, 4:35:29 PM
tid=f8bc5cb417b772d621749a23669f3429

 【请求的 ip 】：128.24.160.163
 【 用  户 】 加了  161         个单词上限2025-12-08 20:50:23
######## 12/8/2025, 8:50:33 PM
tid=f8bc5cb417b772d621749a23669f3429

 【请求的 ip 】：20.169.77.160
 【 用  户 】 加了  161         个单词上限2025-12-08 23:27:19
######## 12/8/2025, 11:27:29 PM
tid=f8bc5cb417b772d621749a23669f3429

 【请求的 ip 】：172.208.23.67
 【 用  户 】 加了  164         个单词上限2025-12-09 02:35:58
######## 12/9/2025, 2:36:09 AM
tid=f8bc5cb417b772d621749a23669f3429

 【请求的 ip 】：172.184.174.119
 【 用  户 】 加了  164         个单词上限2025-12-09 06:22:28
######## 12/9/2025, 6:22:38 AM
tid=f8bc5cb417b772d621749a23669f3429

 【请求的 ip 】：145.132.102.54
 【 用  户 】 加了  164         个单词上限2025-12-09 16:34:06
######## 12/9/2025, 4:34:17 PM
tid=f8bc5cb417b772d621749a23669f3429

 【请求的 ip 】：20.109.39.48
 【 用  户 】 加了  164         个单词上限2025-12-09 20:51:27
######## 12/9/2025, 8:51:38 PM
tid=f8bc5cb417b772d621749a23669f3429

 【请求的 ip 】：172.212.171.156
 【 用  户 】 加了  164         个单词上限2025-12-09 23:28:14
######## 12/9/2025, 11:28:24 PM
tid=f8bc5cb417b772d621749a23669f3429

 【请求的 ip 】：52.234.41.73
 【 用  户 】 加了  164         个单词上限2025-12-10 02:31:59
######## 12/10/2025, 2:32:09 AM
tid=f8bc5cb417b772d621749a23669f3429

 【请求的 ip 】：9.234.149.90
 【 用  户 】 加了  164         个单词上限2025-12-10 06:22:21
######## 12/10/2025, 6:22:31 AM
tid=f8bc5cb417b772d621749a23669f3429

 【请求的 ip 】：135.119.239.49
 【 用  户 】 加了  164         个单词上限2025-12-10 16:33:22
######## 12/10/2025, 4:33:33 PM
tid=f8bc5cb417b772d621749a23669f3429

 【请求的 ip 】：20.55.87.49
 【 用  户 】 加了  164         个单词上限2025-12-10 20:52:04
######## 12/10/2025, 8:52:14 PM
tid=f8bc5cb417b772d621749a23669f3429

 【请求的 ip 】：135.232.200.40
 【 用  户 】 加了  164         个单词上限2025-12-10 23:28:46
######## 12/10/2025, 11:28:56 PM
tid=f8bc5cb417b772d621749a23669f3429

 【请求的 ip 】：52.173.108.25
 【 用  户 】 加了  164         个单词上限2025-12-11 02:34:47
######## 12/11/2025, 2:34:57 AM
tid=f8bc5cb417b772d621749a23669f3429

 【请求的 ip 】：172.172.87.201
 【 用  户 】 加了  167         个单词上限2025-12-11 06:23:14
######## 12/11/2025, 6:23:24 AM
tid=f8bc5cb417b772d621749a23669f3429

 【请求的 ip 】：20.169.73.147
 【 用  户 】 加了  167         个单词上限2025-12-11 16:33:51
######## 12/11/2025, 4:34:02 PM
tid=f8bc5cb417b772d621749a23669f3429

 【请求的 ip 】：48.211.211.34
 【 用  户 】 加了  167         个单词上限2025-12-11 20:53:07
######## 12/11/2025, 8:53:18 PM
tid=f8bc5cb417b772d621749a23669f3429

 【请求的 ip 】：172.172.87.67
 【 用  户 】 加了  167         个单词上限2025-12-11 23:28:55
######## 12/11/2025, 11:29:05 PM
tid=f8bc5cb417b772d621749a23669f3429

 【请求的 ip 】：172.182.224.114
 【 用  户 】 加了  167         个单词上限2025-12-12 02:35:05
######## 12/12/2025, 2:35:15 AM
tid=f8bc5cb417b772d621749a23669f3429

 【请求的 ip 】：64.236.177.1
 【 用  户 】 加了  167         个单词上限2025-12-12 06:23:27
######## 12/12/2025, 6:23:37 AM
tid=f8bc5cb417b772d621749a23669f3429

 【请求的 ip 】：9.234.149.83
 【 用  户 】 加了  169         个单词上限2025-12-12 16:34:06
######## 12/12/2025, 4:34:16 PM
tid=f8bc5cb417b772d621749a23669f3429

 【请求的 ip 】：20.168.110.176
 【 用  户 】 加了  169         个单词上限2025-12-12 20:50:50
######## 12/12/2025, 8:51:00 PM
tid=f8bc5cb417b772d621749a23669f3429

 【请求的 ip 】：172.184.211.38
 【 用  户 】 加了  169         个单词上限2025-12-12 23:26:31
######## 12/12/2025, 11:26:41 PM
tid=f8bc5cb417b772d621749a23669f3429

 【请求的 ip 】：20.49.14.182
 【 用  户 】 加了  169         个单词上限2025-12-13 02:36:20
######## 12/13/2025, 2:36:32 AM
tid=f8bc5cb417b772d621749a23669f3429

 【请求的 ip 】：64.236.193.26
 【 用  户 】 加了  169         个单词上限2025-12-13 06:22:48
######## 12/13/2025, 6:22:57 AM
tid=f8bc5cb417b772d621749a23669f3429

 【请求的 ip 】：172.182.195.179
 【 用  户 】 加了  171         个单词上限2025-12-13 16:29:19
######## 12/13/2025, 4:29:29 PM
tid=f8bc5cb417b772d621749a23669f3429

 【请求的 ip 】：52.159.226.240
 【 用  户 】 加了  171         个单词上限2025-12-13 20:44:21
######## 12/13/2025, 8:44:31 PM
tid=f8bc5cb417b772d621749a23669f3429

 【请求的 ip 】：135.232.200.210
 【 用  户 】 加了  171         个单词上限2025-12-13 23:21:50
######## 12/13/2025, 11:22:01 PM
tid=f8bc5cb417b772d621749a23669f3429

 【请求的 ip 】：20.55.87.51
 【 用  户 】 加了  171         个单词上限2025-12-14 02:30:29
######## 12/14/2025, 2:30:39 AM
tid=f8bc5cb417b772d621749a23669f3429

 【请求的 ip 】：20.161.70.179
 【 用  户 】 加了  171         个单词上限2025-12-14 06:21:06
######## 12/14/2025, 6:21:16 AM
tid=f8bc5cb417b772d621749a23669f3429

 【请求的 ip 】：52.160.166.65
 【 用  户 】 加了  171         个单词上限2025-12-14 16:29:25
######## 12/14/2025, 4:29:35 PM
tid=f8bc5cb417b772d621749a23669f3429

 【请求的 ip 】：172.208.153.208
 【 用  户 】 加了  171         个单词上限2025-12-14 20:44:31
######## 12/14/2025, 8:44:41 PM
tid=f8bc5cb417b772d621749a23669f3429

 【请求的 ip 】：128.24.163.82
 【 用  户 】 加了  171         个单词上限2025-12-14 23:21:58
######## 12/14/2025, 11:22:08 PM
tid=f8bc5cb417b772d621749a23669f3429

 【请求的 ip 】：52.159.244.186
 【 用  户 】 加了  171         个单词上限2025-12-15 02:31:49
######## 12/15/2025, 2:31:59 AM
tid=f8bc5cb417b772d621749a23669f3429

 【请求的 ip 】：40.79.247.70
 【 用  户 】 加了  171         个单词上限2025-12-15 06:21:12
######## 12/15/2025, 6:21:23 AM
tid=f8bc5cb417b772d621749a23669f3429

 【请求的 ip 】：64.236.193.16
 【 用  户 】 加了  171         个单词上限2025-12-15 16:36:25
######## 12/15/2025, 4:36:35 PM
tid=f8bc5cb417b772d621749a23669f3429

 【请求的 ip 】：64.236.200.82
 【 用  户 】 加了  171         个单词上限2025-12-15 20:53:59
######## 12/15/2025, 8:54:09 PM
tid=f8bc5cb417b772d621749a23669f3429

 【请求的 ip 】：4.246.135.193
 【 用  户 】 加了  171         个单词上限2025-12-15 23:27:58
######## 12/15/2025, 11:28:08 PM
tid=f8bc5cb417b772d621749a23669f3429

 【请求的 ip 】：145.132.103.69
 【 用  户 】 加了  171         个单词上限2025-12-16 02:36:55
######## 12/16/2025, 2:37:05 AM
tid=f8bc5cb417b772d621749a23669f3429

 【请求的 ip 】：172.215.216.215
 【 用  户 】 加了  171         个单词上限2025-12-16 06:23:51
######## 12/16/2025, 6:24:01 AM
tid=f8bc5cb417b772d621749a23669f3429

 【请求的 ip 】：48.214.53.67
 【 用  户 】 加了  171         个单词上限2025-12-16 16:34:43
######## 12/16/2025, 4:34:55 PM
tid=f8bc5cb417b772d621749a23669f3429

 【请求的 ip 】：135.232.224.112
 【 用  户 】 加了  171         个单词上限2025-12-16 20:52:17
######## 12/16/2025, 8:52:27 PM
tid=f8bc5cb417b772d621749a23669f3429

 【请求的 ip 】：20.49.61.49
 【 用  户 】 加了  171         个单词上限2025-12-16 23:27:56
######## 12/16/2025, 11:28:06 PM
tid=f8bc5cb417b772d621749a23669f3429

 【请求的 ip 】：40.65.56.230
 【 用  户 】 加了  171         个单词上限2025-12-17 02:36:36
######## 12/17/2025, 2:36:46 AM
tid=f8bc5cb417b772d621749a23669f3429

 【请求的 ip 】：172.184.173.245
 【 用  户 】 加了  174         个单词上限2025-12-17 06:21:43
######## 12/17/2025, 6:21:53 AM
tid=f8bc5cb417b772d621749a23669f3429

 【请求的 ip 】：20.51.198.212
 【 用  户 】 加了  174         个单词上限2025-12-17 16:34:38
######## 12/17/2025, 4:34:48 PM
tid=f8bc5cb417b772d621749a23669f3429

 【请求的 ip 】：40.76.239.102
 【 用  户 】 加了  174         个单词上限2025-12-17 20:52:14
######## 12/17/2025, 8:52:24 PM
tid=f8bc5cb417b772d621749a23669f3429

 【请求的 ip 】：172.214.44.7
 【 用  户 】 加了  174         个单词上限2025-12-17 23:27:45
######## 12/17/2025, 11:27:55 PM
tid=f8bc5cb417b772d621749a23669f3429

 【请求的 ip 】：68.220.60.229
 【 用  户 】 加了  174         个单词上限2025-12-18 02:37:03
######## 12/18/2025, 2:37:13 AM
tid=f8bc5cb417b772d621749a23669f3429

 【请求的 ip 】：128.24.162.148
 【 用  户 】 加了  174         个单词上限2025-12-18 06:23:05
######## 12/18/2025, 6:23:16 AM
tid=f8bc5cb417b772d621749a23669f3429

 【请求的 ip 】：20.163.6.180
 【 用  户 】 加了  174         个单词上限2025-12-18 16:34:00
######## 12/18/2025, 4:34:11 PM
tid=f8bc5cb417b772d621749a23669f3429

 【请求的 ip 】：172.208.126.102
 【 用  户 】 加了  176         个单词上限2025-12-18 20:50:43
######## 12/18/2025, 8:50:54 PM
tid=f8bc5cb417b772d621749a23669f3429

 【请求的 ip 】：145.132.102.181
 【 用  户 】 加了  176         个单词上限2025-12-18 23:26:42
######## 12/18/2025, 11:26:52 PM
tid=f8bc5cb417b772d621749a23669f3429

 【请求的 ip 】：172.182.209.54
 【 用  户 】 加了  176         个单词上限2025-12-19 02:36:08
######## 12/19/2025, 2:36:18 AM
tid=f8bc5cb417b772d621749a23669f3429

 【请求的 ip 】：104.209.7.216
 【 用  户 】 加了  176         个单词上限2025-12-19 06:22:59
######## 12/19/2025, 6:23:10 AM
tid=f8bc5cb417b772d621749a23669f3429

 【请求的 ip 】：20.97.198.241
 【 用  户 】 加了  176         个单词上限2025-12-19 16:33:51
######## 12/19/2025, 4:34:02 PM
tid=f8bc5cb417b772d621749a23669f3429

 【请求的 ip 】：172.183.91.50
 【 用  户 】 加了  176         个单词上限2025-12-19 20:49:03
######## 12/19/2025, 8:49:13 PM
tid=f8bc5cb417b772d621749a23669f3429

 【请求的 ip 】：52.154.20.57
 【 用  户 】 加了  176         个单词上限2025-12-19 23:26:27
######## 12/19/2025, 11:26:36 PM
tid=f8bc5cb417b772d621749a23669f3429

 【请求的 ip 】：68.220.59.120
 【 用  户 】 加了  176         个单词上限2025-12-20 02:34:18
######## 12/20/2025, 2:34:28 AM
tid=f8bc5cb417b772d621749a23669f3429

 【请求的 ip 】：52.225.73.170
 【 用  户 】 加了  176         个单词上限2025-12-20 06:23:35
######## 12/20/2025, 6:23:45 AM
tid=f8bc5cb417b772d621749a23669f3429

 【请求的 ip 】：172.215.217.64
 【 用  户 】 加了  176         个单词上限2025-12-20 16:29:16
######## 12/20/2025, 4:29:26 PM
tid=f8bc5cb417b772d621749a23669f3429

 【请求的 ip 】：64.236.161.35
 【 用  户 】 加了  176         个单词上限2025-12-20 20:44:05
######## 12/20/2025, 8:44:15 PM
tid=f8bc5cb417b772d621749a23669f3429

 【请求的 ip 】：172.215.208.194
 【 用  户 】 加了  176         个单词上限2025-12-20 23:21:38
######## 12/20/2025, 11:21:48 PM
tid=f8bc5cb417b772d621749a23669f3429

 【请求的 ip 】：52.234.45.177
 【 用  户 】 加了  176         个单词上限2025-12-21 02:30:15
######## 12/21/2025, 2:30:26 AM
tid=f8bc5cb417b772d621749a23669f3429

 【请求的 ip 】：4.246.135.36
 【 用  户 】 加了  176         个单词上限2025-12-21 06:21:17
######## 12/21/2025, 6:21:27 AM
tid=f8bc5cb417b772d621749a23669f3429

 【请求的 ip 】：172.215.217.241
 【 用  户 】 加了  176         个单词上限2025-12-21 16:29:47
######## 12/21/2025, 4:29:57 PM
tid=f8bc5cb417b772d621749a23669f3429

 【请求的 ip 】：48.214.53.181
 【 用  户 】 加了  176         个单词上限2025-12-21 20:45:04
######## 12/21/2025, 8:45:14 PM
tid=f8bc5cb417b772d621749a23669f3429

 【请求的 ip 】：172.182.226.209
 【 用  户 】 加了  176         个单词上限2025-12-21 23:21:45
######## 12/21/2025, 11:21:55 PM
tid=f8bc5cb417b772d621749a23669f3429

 【请求的 ip 】：172.184.211.241
 【 用  户 】 加了  176         个单词上限2025-12-22 02:31:59
######## 12/22/2025, 2:32:13 AM
tid=f8bc5cb417b772d621749a23669f3429

 【请求的 ip 】：20.169.50.38
 【 用  户 】 加了  176         个单词上限2025-12-22 06:22:24
######## 12/22/2025, 6:22:35 AM
tid=f8bc5cb417b772d621749a23669f3429

 【请求的 ip 】：4.227.135.148
 【 用  户 】 加了  176         个单词上限2025-12-22 16:34:40
######## 12/22/2025, 4:34:50 PM
tid=f8bc5cb417b772d621749a23669f3429

 【请求的 ip 】：172.215.216.224
 【 用  户 】 加了  176         个单词上限2025-12-22 20:49:59
######## 12/22/2025, 8:50:09 PM
tid=f8bc5cb417b772d621749a23669f3429

 【请求的 ip 】：52.165.251.247
 【 用  户 】 加了  176         个单词上限2025-12-22 23:25:54
######## 12/22/2025, 11:26:05 PM
tid=f8bc5cb417b772d621749a23669f3429

 【请求的 ip 】：135.232.177.176
 【 用  户 】 加了  176         个单词上限2025-12-23 02:35:16
######## 12/23/2025, 2:35:26 AM
tid=f8bc5cb417b772d621749a23669f3429

 【请求的 ip 】：64.236.201.19
 【 用  户 】 加了  176         个单词上限2025-12-23 06:23:44
######## 12/23/2025, 6:23:55 AM
tid=f8bc5cb417b772d621749a23669f3429

 【请求的 ip 】：135.232.193.35
 【 用  户 】 加了  176         个单词上限2025-12-23 16:34:13
######## 12/23/2025, 4:34:23 PM
tid=f8bc5cb417b772d621749a23669f3429

 【请求的 ip 】：20.163.32.232
 【 用  户 】 加了  176         个单词上限2025-12-23 20:51:33
######## 12/23/2025, 8:51:43 PM
tid=f8bc5cb417b772d621749a23669f3429

 【请求的 ip 】：172.208.127.192
 【 用  户 】 加了  176         个单词上限2025-12-23 23:26:10
######## 12/23/2025, 11:26:20 PM
tid=f8bc5cb417b772d621749a23669f3429

 【请求的 ip 】：172.182.194.210
 【 用  户 】 加了  176         个单词上限2025-12-24 02:35:43
######## 12/24/2025, 2:35:53 AM
tid=f8bc5cb417b772d621749a23669f3429

 【请求的 ip 】：20.109.38.120
 【 用  户 】 加了  176         个单词上限2025-12-24 06:22:35
######## 12/24/2025, 6:22:45 AM
tid=f8bc5cb417b772d621749a23669f3429

 【请求的 ip 】：172.182.209.52
 【 用  户 】 加了  176         个单词上限2025-12-24 16:33:53
######## 12/24/2025, 4:34:03 PM
tid=f8bc5cb417b772d621749a23669f3429

 【请求的 ip 】：64.236.200.228
 【 用  户 】 加了  176         个单词上限2025-12-24 20:50:03
######## 12/24/2025, 8:50:13 PM
tid=f8bc5cb417b772d621749a23669f3429

 【请求的 ip 】：172.208.23.67
 【 用  户 】 加了  176         个单词上限2025-12-24 23:25:05
######## 12/24/2025, 11:25:15 PM
tid=f8bc5cb417b772d621749a23669f3429

 【请求的 ip 】：52.159.247.231
 【 用  户 】 加了  176         个单词上限2025-12-25 02:34:28
######## 12/25/2025, 2:34:37 AM
tid=f8bc5cb417b772d621749a23669f3429

 【请求的 ip 】：172.184.191.164
 【 用  户 】 加了  176         个单词上限2025-12-25 06:23:15
######## 12/25/2025, 6:23:26 AM
tid=f8bc5cb417b772d621749a23669f3429

 【请求的 ip 】：145.132.101.193
 【 用  户 】 加了  176         个单词上限2025-12-25 16:32:27
######## 12/25/2025, 4:32:37 PM
tid=f8bc5cb417b772d621749a23669f3429

 【请求的 ip 】：68.154.118.245
 【 用  户 】 加了  176         个单词上限2025-12-25 20:48:59
######## 12/25/2025, 8:49:08 PM
tid=f8bc5cb417b772d621749a23669f3429

 【请求的 ip 】：172.215.218.18
 【 用  户 】 加了  176         个单词上限2025-12-25 23:24:09
######## 12/25/2025, 11:24:19 PM
tid=f8bc5cb417b772d621749a23669f3429

 【请求的 ip 】：74.249.78.37
 【 用  户 】 加了  176         个单词上限2025-12-26 02:33:48
######## 12/26/2025, 2:33:58 AM
tid=f8bc5cb417b772d621749a23669f3429

 【请求的 ip 】：20.161.45.114
 【 用  户 】 加了  176         个单词上限2025-12-26 06:22:42
######## 12/26/2025, 6:22:52 AM
tid=60501b605e1bef257f5ce46bb1f78e09

 【请求的 ip 】：52.234.45.178
 【 用  户 】 加了  0         个单词上限2025-12-26 16:32:23
######## 12/26/2025, 4:32:33 PM
tid=60501b605e1bef257f5ce46bb1f78e09

 【请求的 ip 】：20.109.95.104
 【 用  户 】 加了  0         个单词上限2025-12-26 20:49:08
######## 12/26/2025, 8:49:19 PM
tid=60501b605e1bef257f5ce46bb1f78e09

 【请求的 ip 】：135.232.177.163
 【 用  户 】 加了  0         个单词上限2025-12-26 23:24:29
######## 12/26/2025, 11:24:39 PM
tid=60501b605e1bef257f5ce46bb1f78e09

 【请求的 ip 】：68.220.56.240
 【 用  户 】 加了  0         个单词上限2025-12-27 02:33:54
######## 12/27/2025, 2:34:03 AM
tid=60501b605e1bef257f5ce46bb1f78e09

 【请求的 ip 】：68.220.58.2
 【 用  户 】 加了  3         个单词上限2025-12-27 06:22:36
######## 12/27/2025, 6:22:46 AM
tid=60501b605e1bef257f5ce46bb1f78e09

 【请求的 ip 】：172.183.135.149
 【 用  户 】 加了  3         个单词上限2025-12-27 16:30:34
######## 12/27/2025, 4:30:43 PM
tid=60501b605e1bef257f5ce46bb1f78e09

 【请求的 ip 】：52.159.247.192
 【 用  户 】 加了  3         个单词上限2025-12-27 20:45:59
######## 12/27/2025, 8:46:09 PM
tid=60501b605e1bef257f5ce46bb1f78e09

 【请求的 ip 】：68.220.61.185
 【 用  户 】 加了  3         个单词上限2025-12-27 23:21:57
######## 12/27/2025, 11:22:07 PM
tid=60501b605e1bef257f5ce46bb1f78e09

 【请求的 ip 】：68.220.62.106
 【 用  户 】 加了  3         个单词上限2025-12-28 02:32:29
######## 12/28/2025, 2:32:39 AM
tid=60501b605e1bef257f5ce46bb1f78e09

 【请求的 ip 】：20.168.110.17
 【 用  户 】 加了  3         个单词上限2025-12-28 06:22:20
######## 12/28/2025, 6:22:30 AM
tid=60501b605e1bef257f5ce46bb1f78e09

 【请求的 ip 】：68.220.59.51
 【 用  户 】 加了  3         个单词上限2025-12-28 16:30:47
######## 12/28/2025, 4:30:57 PM
tid=60501b605e1bef257f5ce46bb1f78e09

 【请求的 ip 】：64.236.153.90
 【 用  户 】 加了  6         个单词上限2025-12-28 20:46:58
######## 12/28/2025, 8:47:08 PM
tid=60501b605e1bef257f5ce46bb1f78e09

 【请求的 ip 】：20.161.44.229
 【 用  户 】 加了  6         个单词上限2025-12-28 23:22:31
######## 12/28/2025, 11:22:41 PM
tid=60501b605e1bef257f5ce46bb1f78e09

 【请求的 ip 】：172.183.94.161
 【 用  户 】 加了  6         个单词上限2025-12-29 02:33:26
######## 12/29/2025, 2:33:37 AM
tid=60501b605e1bef257f5ce46bb1f78e09

 【请求的 ip 】：52.176.138.178
 【 用  户 】 加了  6         个单词上限2025-12-29 06:22:40
######## 12/29/2025, 6:22:50 AM
tid=60501b605e1bef257f5ce46bb1f78e09

 【请求的 ip 】：52.150.28.38
 【 用  户 】 加了  6         个单词上限2025-12-29 16:36:14
######## 12/29/2025, 4:36:25 PM
tid=60501b605e1bef257f5ce46bb1f78e09

 【请求的 ip 】：172.184.174.117
 【 用  户 】 加了  6         个单词上限2025-12-29 20:52:22
######## 12/29/2025, 8:52:32 PM
tid=60501b605e1bef257f5ce46bb1f78e09

 【请求的 ip 】：172.184.213.161
 【 用  户 】 加了  6         个单词上限2025-12-29 23:26:42
######## 12/29/2025, 11:26:52 PM
tid=60501b605e1bef257f5ce46bb1f78e09

 【请求的 ip 】：172.215.211.49
 【 用  户 】 加了  6         个单词上限2025-12-30 02:34:55
######## 12/30/2025, 2:35:05 AM
tid=60501b605e1bef257f5ce46bb1f78e09

 【请求的 ip 】：172.208.127.198
 【 用  户 】 加了  6         个单词上限2025-12-30 06:22:50
######## 12/30/2025, 6:23:00 AM
tid=60501b605e1bef257f5ce46bb1f78e09

 【请求的 ip 】：135.232.177.203
 【 用  户 】 加了  6         个单词上限2025-12-30 16:34:00
######## 12/30/2025, 4:34:10 PM
tid=60501b605e1bef257f5ce46bb1f78e09

 【请求的 ip 】：64.236.134.213
 【 用  户 】 加了  6         个单词上限2025-12-30 20:51:35
######## 12/30/2025, 8:51:45 PM
tid=60501b605e1bef257f5ce46bb1f78e09

 【请求的 ip 】：9.234.151.82
 【 用  户 】 加了  6         个单词上限2025-12-30 23:26:10
######## 12/30/2025, 11:26:21 PM
tid=60501b605e1bef257f5ce46bb1f78e09

 【请求的 ip 】：145.132.100.181
 【 用  户 】 加了  6         个单词上限2025-12-31 02:35:51
######## 12/31/2025, 2:36:01 AM
tid=60501b605e1bef257f5ce46bb1f78e09

 【请求的 ip 】：64.236.169.3
 【 用  户 】 加了  6         个单词上限2025-12-31 06:23:11
######## 12/31/2025, 6:23:21 AM
tid=60501b605e1bef257f5ce46bb1f78e09

 【请求的 ip 】：172.174.165.225
 【 用  户 】 加了  6         个单词上限2025-12-31 16:34:01
######## 12/31/2025, 4:34:11 PM
tid=60501b605e1bef257f5ce46bb1f78e09

 【请求的 ip 】：13.83.167.59
 【 用  户 】 加了  6         个单词上限2025-12-31 20:50:16
######## 12/31/2025, 8:50:26 PM
tid=60501b605e1bef257f5ce46bb1f78e09

 【请求的 ip 】：172.182.225.193
 【 用  户 】 加了  6         个单词上限2025-12-31 23:24:45
######## 12/31/2025, 11:24:55 PM
tid=60501b605e1bef257f5ce46bb1f78e09

 【请求的 ip 】：52.234.43.177
 【 用  户 】 加了  6         个单词上限2026-01-01 02:34:12
######## 1/1/2026, 2:34:23 AM
tid=60501b605e1bef257f5ce46bb1f78e09

 【请求的 ip 】：145.132.99.131
 【 用  户 】 加了  6         个单词上限2026-01-01 06:23:53
######## 1/1/2026, 6:24:03 AM
tid=60501b605e1bef257f5ce46bb1f78e09

 【请求的 ip 】：172.215.216.196
 【 用  户 】 加了  6         个单词上限2026-01-01 16:33:31
######## 1/1/2026, 4:33:41 PM
tid=60501b605e1bef257f5ce46bb1f78e09

 【请求的 ip 】：68.220.60.149
 【 用  户 】 加了  6         个单词上限2026-01-01 20:50:03
######## 1/1/2026, 8:50:13 PM
tid=60501b605e1bef257f5ce46bb1f78e09

 【请求的 ip 】：13.83.161.18
 【 用  户 】 加了  6         个单词上限2026-01-01 23:25:01
######## 1/1/2026, 11:25:10 PM
tid=60501b605e1bef257f5ce46bb1f78e09

 【请求的 ip 】：52.161.55.199
 【 用  户 】 加了  6         个单词上限2026-01-02 02:34:27
######## 1/2/2026, 2:34:37 AM
tid=60501b605e1bef257f5ce46bb1f78e09

 【请求的 ip 】：172.208.152.210
 【 用  户 】 加了  6         个单词上限2026-01-02 06:23:31
######## 1/2/2026, 6:23:41 AM
tid=60501b605e1bef257f5ce46bb1f78e09

 【请求的 ip 】：172.184.209.186
 【 用  户 】 加了  6         个单词上限2026-01-02 16:33:43
######## 1/2/2026, 4:33:54 PM
tid=60501b605e1bef257f5ce46bb1f78e09

 【请求的 ip 】：48.214.54.105
 【 用  户 】 加了  6         个单词上限2026-01-02 20:49:13
######## 1/2/2026, 8:49:23 PM
tid=60501b605e1bef257f5ce46bb1f78e09

 【请求的 ip 】：128.24.161.18
 【 用  户 】 加了  6         个单词上限2026-01-02 23:25:41
######## 1/2/2026, 11:25:51 PM
tid=60501b605e1bef257f5ce46bb1f78e09

 【请求的 ip 】：20.81.159.114
 【 用  户 】 加了  6         个单词上限2026-01-03 02:34:17
######## 1/3/2026, 2:34:28 AM
tid=60501b605e1bef257f5ce46bb1f78e09

 【请求的 ip 】：20.109.38.161
 【 用  户 】 加了  6         个单词上限2026-01-03 06:23:44
######## 1/3/2026, 6:23:54 AM
tid=60501b605e1bef257f5ce46bb1f78e09

 【请求的 ip 】：172.184.211.245
 【 用  户 】 加了  6         个单词上限2026-01-03 16:30:52
######## 1/3/2026, 4:31:02 PM
tid=60501b605e1bef257f5ce46bb1f78e09

 【请求的 ip 】：68.220.59.113
 【 用  户 】 加了  6         个单词上限2026-01-03 20:46:39
######## 1/3/2026, 8:46:49 PM
tid=60501b605e1bef257f5ce46bb1f78e09

 【请求的 ip 】：52.176.124.225
 【 用  户 】 加了  6         个单词上限2026-01-03 23:22:38
######## 1/3/2026, 11:22:48 PM
tid=60501b605e1bef257f5ce46bb1f78e09

 【请求的 ip 】：64.236.201.34
 【 用  户 】 加了  6         个单词上限2026-01-04 02:32:35
######## 1/4/2026, 2:32:45 AM
tid=60501b605e1bef257f5ce46bb1f78e09

 【请求的 ip 】：172.215.217.68
 【 用  户 】 加了  6         个单词上限2026-01-04 06:22:29
######## 1/4/2026, 6:22:39 AM
tid=60501b605e1bef257f5ce46bb1f78e09

 【请求的 ip 】：68.220.62.179
 【 用  户 】 加了  6         个单词上限2026-01-04 16:31:25
######## 1/4/2026, 4:31:36 PM
tid=60501b605e1bef257f5ce46bb1f78e09

 【请求的 ip 】：20.161.60.98
 【 用  户 】 加了  6         个单词上限2026-01-04 20:47:40
######## 1/4/2026, 8:47:50 PM
tid=60501b605e1bef257f5ce46bb1f78e09

 【请求的 ip 】：20.51.198.194
 【 用  户 】 加了  6         个单词上限2026-01-04 23:22:38
######## 1/4/2026, 11:22:49 PM
tid=60501b605e1bef257f5ce46bb1f78e09

 【请求的 ip 】：40.76.117.225
 【 用  户 】 加了  6         个单词上限2026-01-05 02:33:06
######## 1/5/2026, 2:33:16 AM
tid=60501b605e1bef257f5ce46bb1f78e09

 【请求的 ip 】：20.171.125.212
 【 用  户 】 加了  6         个单词上限2026-01-05 06:22:45
######## 1/5/2026, 6:22:55 AM
tid=60501b605e1bef257f5ce46bb1f78e09

 【请求的 ip 】：104.209.7.228
 【 用  户 】 加了  6         个单词上限2026-01-05 16:38:15
######## 1/5/2026, 4:38:25 PM
tid=60501b605e1bef257f5ce46bb1f78e09

 【请求的 ip 】：135.232.200.70
 【 用  户 】 加了  6         个单词上限2026-01-05 20:54:09
######## 1/5/2026, 8:54:22 PM
tid=60501b605e1bef257f5ce46bb1f78e09

 【请求的 ip 】：145.132.99.103
 【 用  户 】 加了  6         个单词上限2026-01-05 23:28:03
######## 1/5/2026, 11:28:14 PM
tid=60501b605e1bef257f5ce46bb1f78e09

 【请求的 ip 】：20.51.198.193
 【 用  户 】 加了  6         个单词上限2026-01-06 02:38:02
######## 1/6/2026, 2:38:12 AM
tid=60501b605e1bef257f5ce46bb1f78e09

 【请求的 ip 】：52.159.243.194
 【 用  户 】 加了  6         个单词上限2026-01-06 06:24:30
######## 1/6/2026, 6:24:39 AM
tid=60501b605e1bef257f5ce46bb1f78e09

 【请求的 ip 】：172.215.211.16
 【 用  户 】 加了  6         个单词上限2026-01-06 16:35:50
######## 1/6/2026, 4:36:02 PM
tid=60501b605e1bef257f5ce46bb1f78e09

 【请求的 ip 】：132.196.19.17
 【 用  户 】 加了  6         个单词上限2026-01-06 20:52:00
######## 1/6/2026, 8:52:10 PM
tid=60501b605e1bef257f5ce46bb1f78e09

 【请求的 ip 】：20.169.72.23
 【 用  户 】 加了  6         个单词上限2026-01-06 23:27:09
######## 1/6/2026, 11:27:19 PM
tid=60501b605e1bef257f5ce46bb1f78e09

 【请求的 ip 】：172.215.211.19
 【 用  户 】 加了  6         个单词上限2026-01-07 02:36:30
######## 1/7/2026, 2:36:39 AM
tid=60501b605e1bef257f5ce46bb1f78e09

 【请求的 ip 】：68.220.59.230
 【 用  户 】 加了  6         个单词上限2026-01-07 06:24:57
######## 1/7/2026, 6:25:07 AM
tid=60501b605e1bef257f5ce46bb1f78e09

 【请求的 ip 】：172.215.209.177
 【 用  户 】 加了  6         个单词上限2026-01-07 16:35:40
######## 1/7/2026, 4:35:50 PM
tid=60501b605e1bef257f5ce46bb1f78e09

 【请求的 ip 】：52.159.226.244
 【 用  户 】 加了  6         个单词上限2026-01-07 20:53:08
######## 1/7/2026, 8:53:18 PM
tid=60501b605e1bef257f5ce46bb1f78e09

 【请求的 ip 】：52.159.245.164
 【 用  户 】 加了  6         个单词上限2026-01-07 23:29:15
######## 1/7/2026, 11:29:25 PM
tid=60501b605e1bef257f5ce46bb1f78e09

 【请求的 ip 】：68.220.61.211
 【 用  户 】 加了  6         个单词上限2026-01-08 02:37:48
######## 1/8/2026, 2:37:59 AM
tid=60501b605e1bef257f5ce46bb1f78e09

 【请求的 ip 】：48.214.53.119
 【 用  户 】 加了  6         个单词上限2026-01-08 06:24:09
######## 1/8/2026, 6:24:19 AM
tid=60501b605e1bef257f5ce46bb1f78e09

 【请求的 ip 】：52.234.43.179
 【 用  户 】 加了  6         个单词上限2026-01-08 16:35:22
######## 1/8/2026, 4:35:32 PM
tid=60501b605e1bef257f5ce46bb1f78e09

 【请求的 ip 】：52.225.73.170
 【 用  户 】 加了  6         个单词上限2026-01-08 20:53:42
######## 1/8/2026, 8:53:52 PM
tid=60501b605e1bef257f5ce46bb1f78e09

 【请求的 ip 】：64.236.141.183
 【 用  户 】 加了  6         个单词上限2026-01-08 23:29:56
######## 1/8/2026, 11:30:06 PM
tid=60501b605e1bef257f5ce46bb1f78e09

 【请求的 ip 】：68.220.60.3
 【 用  户 】 加了  6         个单词上限2026-01-09 02:33:54
######## 1/9/2026, 2:34:04 AM
tid=60501b605e1bef257f5ce46bb1f78e09

 【请求的 ip 】：52.160.164.122
 【 用  户 】 加了  6         个单词上限2026-01-09 06:24:35
######## 1/9/2026, 6:24:45 AM
tid=60501b605e1bef257f5ce46bb1f78e09

 【请求的 ip 】：20.55.223.213
 【 用  户 】 加了  6         个单词上限2026-01-09 16:35:19
######## 1/9/2026, 4:35:29 PM
tid=60501b605e1bef257f5ce46bb1f78e09

 【请求的 ip 】：172.184.220.154
 【 用  户 】 加了  6         个单词上限2026-01-09 20:52:30
######## 1/9/2026, 8:52:40 PM
tid=60501b605e1bef257f5ce46bb1f78e09

 【请求的 ip 】：52.190.140.133
 【 用  户 】 加了  6         个单词上限2026-01-09 23:27:55
######## 1/9/2026, 11:28:05 PM
tid=60501b605e1bef257f5ce46bb1f78e09

 【请求的 ip 】：172.184.211.34
 【 用  户 】 加了  6         个单词上限2026-01-10 02:37:06
######## 1/10/2026, 2:37:16 AM
tid=60501b605e1bef257f5ce46bb1f78e09

 【请求的 ip 】：20.168.119.17
 【 用  户 】 加了  6         个单词上限2026-01-10 06:24:45
######## 1/10/2026, 6:24:55 AM
tid=60501b605e1bef257f5ce46bb1f78e09

 【请求的 ip 】：52.161.45.224
 【 用  户 】 加了  6         个单词上限2026-01-10 16:30:43
######## 1/10/2026, 4:30:53 PM
tid=60501b605e1bef257f5ce46bb1f78e09

 【请求的 ip 】：20.161.67.212
 【 用  户 】 加了  6         个单词上限2026-01-10 20:46:42
######## 1/10/2026, 8:46:52 PM
tid=60501b605e1bef257f5ce46bb1f78e09

 【请求的 ip 】：20.161.28.181
 【 用  户 】 加了  6         个单词上限2026-01-10 23:22:58
######## 1/10/2026, 11:23:08 PM
tid=60501b605e1bef257f5ce46bb1f78e09

 【请求的 ip 】：52.154.130.210
 【 用  户 】 加了  6         个单词上限2026-01-11 02:33:44
######## 1/11/2026, 2:33:55 AM
tid=60501b605e1bef257f5ce46bb1f78e09

 【请求的 ip 】：172.190.93.129
 【 用  户 】 加了  6         个单词上限